"swab_id","survey_id","fid","latitude_swab","longitude_swab","precision_swab","datetime_swab","microhabitat","temperature_of_substrate_C","temperature_of_animal_C","species","sex","lifestage","weight_of_animal_bag_g","weight_of_bag","svl_mm","tl_mm","swabbed","extraction_notes","visit_batch","site_id","date","start_time_edt","end_time_edt","abundance_ves","site_name","lat","long","year","season","doy","doy_min","doy_max","doy_ave","doy_ves_min","doy_ves_max","doy_ves_ave","doy_bd","season3_samp","season3_mo","CT1","CT2","Ct_Mean","Quantity_Mean","CT3","CT4","Ct_Mean2","Quantity_Mean2","num_runs","bd_status","CT_Mean_Total","Quantity_Mean_Total","bd_load","bd_positive"
"MWUT001",1,NA,35.915391,-84.402816,NA,NA,"tree",NA,NA,"racl","female","subadult",175,150,48,27,"y",NA,0,1,2022-03-15,"19:51:00","23:13:00","n","ornl_powerhouse",35.914888,-84.4000154,2022,"spring",74,74,264,169,NA,NA,NA,74,"spring","spring",27.53,27.35,27.44,2050.304932,NA,NA,NA,NA,1,"positive",27.44,2046.83260627901,2046.83260627901,1
"MWUT002",1,NA,35.915391,-84.402816,NA,NA,"water",NA,NA,"racl","female","subadult",170,149,49,25,"y",NA,0,1,2022-03-15,"19:51:00","23:13:00","n","ornl_powerhouse",35.914888,-84.4000154,2022,"spring",74,74,264,169,NA,NA,NA,74,"spring","spring",0,0,NA,NA,NA,NA,NA,NA,1,"negative",NA,NA,0,0
"MWUT003",1,NA,35.915837,-84.402967,NA,NA,"water",NA,NA,"racl","female","subadult",190,130,74,33,"y",NA,0,1,2022-03-15,"19:51:00","23:13:00","n","ornl_powerhouse",35.914888,-84.4000154,2022,"spring",74,74,264,169,NA,NA,NA,74,"spring","spring",0,0,NA,NA,NA,NA,NA,NA,1,"negative",NA,NA,0,0
"MWUT004",1,NA,35.915837,-84.402967,NA,NA,"water",NA,NA,"racl","female","subadult",300,260,68,32,"y",NA,0,1,2022-03-15,"19:51:00","23:13:00","n","ornl_powerhouse",35.914888,-84.4000154,2022,"spring",74,74,264,169,NA,NA,NA,74,"spring","spring",30.109,30.244,30.177,307.0488586,NA,NA,NA,NA,1,"positive",30.1765,306.733246937758,306.733246937758,1
"MWUT005",1,NA,35.915837,-84.402967,NA,NA,"water",NA,NA,"racl","male","subadult",265,215,65,29,"y",NA,0,1,2022-03-15,"19:51:00","23:13:00","n","ornl_powerhouse",35.914888,-84.4000154,2022,"spring",74,74,264,169,NA,NA,NA,74,"spring","spring",36.535,36.318,36.427,4.029039383,NA,NA,NA,NA,1,"positive",36.4265,4.01846886604112,4.01846886604112,1
"MWUT006",1,NA,35.915815,-84.403147,NA,NA,"water",NA,NA,"racl","female","subadult",120,105,50,22,"y",NA,0,1,2022-03-15,"19:51:00","23:13:00","n","ornl_powerhouse",35.914888,-84.4000154,2022,"spring",74,74,264,169,NA,NA,NA,74,"spring","spring",0,39.185,39.185,0.59325856,0,0,NA,NA,2,"negative",39.185,0.593078292035967,0,0
"MWUT007",3,NA,35.951121,-83.854762,NA,NA,"water",NA,NA,"racl","female","subadult",215,185,57,27,"y",NA,0,3,2022-03-22,"19:42:00","21:20:00","n","fotr_big_pond",35.951944,-83.854111,2022,"spring",81,81,146,113.5,NA,NA,NA,81,"spring","spring",0,0,NA,NA,NA,NA,NA,NA,1,"negative",NA,NA,0,0
"MWUT008",9,NA,35.957569,-83.868485,NA,NA,"water",NA,NA,"racl","female","subadult",185,165,49,23,"y",NA,0,9,2022-03-24,"20:14:00","23:02:00","n","ijams_complex_pond2",35.957569,-83.868485,2022,"spring",83,83,83,83,NA,NA,NA,83,"spring","spring",0,0,NA,NA,NA,NA,NA,NA,1,"negative",NA,NA,0,0
"MWUT009",10,NA,35.957783,-83.869219,NA,NA,"water",NA,NA,"racl","female","adult",170,100,85,42,"y",NA,0,10,2022-03-24,"20:14:00","23:02:00","n","ijams_complex_pond3",35.957797,-83.869251,2022,"spring",83,83,269,176,NA,NA,NA,83,"spring","spring",33.497,32.993,33.245,37.07701874,NA,NA,NA,NA,1,"positive",33.245,36.5115558800591,36.5115558800591,1
"MWUT010",10,NA,35.957794,-83.869259,NA,NA,"water",NA,NA,"rapa","male","subadult",300,290,41,24.5,"y",NA,0,10,2022-03-24,"20:14:00","23:02:00","n","ijams_complex_pond3",35.957797,-83.869251,2022,"spring",83,83,269,176,NA,NA,NA,83,"spring","spring",37.736,35.541,36.638,4.522742271,NA,NA,NA,NA,1,"positive",36.6385,3.46896098659556,3.46896098659556,1
"MWUT011",13,NA,36.379585,-84.20209,NA,NA,"water, brush",NA,NA,"raca","male","adult",370,180,124,54,"y",NA,0,13,2022-03-27,"21:17:00","23:12:00","n","nc_frozen_net",36.37968,-84.202037,2022,"spring",86,86,86,86,NA,NA,NA,86,"spring","spring",27.847,27.564,27.705,1710.869019,NA,NA,NA,NA,1,"positive",27.7055,1702.57095529816,1702.57095529816,1
"MWUT012",13,NA,36.379449,-84.202064,NA,NA,"water, reeds",NA,NA,"racl","female","subadult",180,155,124,54,"y",NA,0,13,2022-03-27,"21:17:00","23:12:00","n","nc_frozen_net",36.37968,-84.202037,2022,"spring",86,86,86,86,NA,NA,NA,86,"spring","spring",34.179,34.226,34.202,18.79646873,NA,NA,NA,NA,1,"positive",34.2025,18.7931968454385,18.7931968454385,1
"MWUT013",13,NA,36.380318,-84.202716,NA,NA,"water, brush",NA,NA,"raca","female","subadult",395,345,69,33,"y",NA,0,13,2022-03-27,"21:17:00","23:12:00","n","nc_frozen_net",36.37968,-84.202037,2022,"spring",86,86,86,86,NA,NA,NA,86,"spring","spring",0,0,NA,NA,NA,NA,NA,NA,1,"negative",NA,NA,0,0
"MWUT014",13,NA,36.380318,-84.202716,NA,NA,"tall grass",NA,NA,"raca","female","subadult",240,195,66,31,"y",NA,0,13,2022-03-27,"21:17:00","23:12:00","n","nc_frozen_net",36.37968,-84.202037,2022,"spring",86,86,86,86,NA,NA,NA,86,"spring","spring",0,0,NA,NA,NA,NA,NA,NA,1,"negative",NA,NA,0,0
"MWUT015",13,NA,36.380421,-84.202557,NA,NA,"water,brush",NA,NA,"racl","female","subadult",110,95,48,23,"y",NA,0,13,2022-03-27,"21:17:00","23:12:00","n","nc_frozen_net",36.37968,-84.202037,2022,"spring",86,86,86,86,NA,NA,NA,86,"spring","spring",33.26,31.761,32.511,69.16405487,NA,NA,NA,NA,1,"positive",32.5105,60.7694453860892,60.7694453860892,1
"MWUT016",14,NA,35.913902,-84.402497,NA,NA,"asphalt",19,14,"racl","female","subadult",210,170,68,31.5,"y",NA,0,1,2022-04-13,"20:21:00","23:54:00","n","ornl_powerhouse",35.914888,-84.4000154,2022,"spring",103,74,264,169,NA,NA,NA,103,"spring","spring",36.405,38.004,37.205,2.711287498,NA,NA,NA,NA,1,"positive",37.2045,2.3426212664254,2.3426212664254,1
"MWUT017",14,NA,35.914669,-84.403961,NA,NA,"water, reeds",16,14,"racl",NA,"subadult",160,150,45,18.5,"y",NA,0,1,2022-04-13,"20:21:00","23:54:00","n","ornl_powerhouse",35.914888,-84.4000154,2022,"spring",103,74,264,169,NA,NA,NA,103,"spring","spring",28.778,29.512,29.145,647.6229858,NA,NA,NA,NA,1,"positive",29.145,627.309262525931,627.309262525931,1
"MWUT018",14,NA,35.91469,-84.404031,NA,NA,"water,reeds",17,17,"rasp","female","adult",120,85,72,43,"y",NA,0,1,2022-04-13,"20:21:00","23:54:00","n","ornl_powerhouse",35.914888,-84.4000154,2022,"spring",103,74,264,169,NA,NA,NA,103,"spring","spring",33.556,33.739,33.648,27.67090607,NA,NA,NA,NA,1,"positive",33.6475,27.6175051952461,27.6175051952461,1
"MWUT019",14,NA,35.915321,-84.403559,NA,NA,"gravel road",16,16,"racl","female","subadult",55,20,66,31,"y",NA,0,1,2022-04-13,"20:21:00","23:54:00","n","ornl_powerhouse",35.914888,-84.4000154,2022,"spring",103,74,264,169,NA,NA,NA,103,"spring","spring",0,0,NA,NA,NA,NA,NA,NA,1,"negative",NA,NA,0,0
"MWUT020",14,NA,35.915321,-84.403559,NA,NA,"gravel road",15,15,"racl","female","subadult",53,20,63,30,"y",NA,0,1,2022-04-13,"20:21:00","23:54:00","n","ornl_powerhouse",35.914888,-84.4000154,2022,"spring",103,74,264,169,NA,NA,NA,103,"spring","spring",0,0,NA,NA,NA,NA,NA,NA,1,"negative",NA,NA,0,0
"MWUT021",14,NA,35.915398,-84.403495,NA,NA,"gravel road",15,14,"racl",NA,"subadult",49.5,35,41,19,"y",NA,0,1,2022-04-13,"20:21:00","23:54:00","n","ornl_powerhouse",35.914888,-84.4000154,2022,"spring",103,74,264,169,NA,NA,NA,103,"spring","spring",39.727,38.543,39.135,0.666689515,NA,NA,NA,NA,1,"positive",39.135,0.614007435160825,0.614007435160825,1
"MWUT022",14,NA,35.915384,-84.403239,NA,NA,"grass",16,15,"rasp","female","adult",65,20,70,51,"y",NA,0,1,2022-04-13,"20:21:00","23:54:00","n","ornl_powerhouse",35.914888,-84.4000154,2022,"spring",103,74,264,169,NA,NA,NA,103,"spring","spring",38.121,36.552,37.336,2.462443352,NA,NA,NA,NA,1,"positive",37.3365,2.13766404395754,2.13766404395754,1
"MWUT023",14,NA,35.915334,-84.403409,NA,NA,"gravel road",15,14,"racl",NA,"subadult",27,20,35,15,"y",NA,0,1,2022-04-13,"20:21:00","23:54:00","n","ornl_powerhouse",35.914888,-84.4000154,2022,"spring",103,74,264,169,NA,NA,NA,103,"spring","spring",0,39.443,39.443,0.496069372,0,0,NA,NA,2,"negative",39.443,0.495900061468149,0,0
"MWUT024",14,NA,35.915367,-84.402887,NA,NA,"mud,water",14,15,"racl","female","subadult",160,130,56,28,"y",NA,0,1,2022-04-13,"20:21:00","23:54:00","n","ornl_powerhouse",35.914888,-84.4000154,2022,"spring",103,74,264,169,NA,NA,NA,103,"spring","spring",32.627,30.71,31.669,133.9693451,NA,NA,NA,NA,1,"positive",31.6685,108.973939084377,108.973939084377,1
"MWUT025",15,NA,35.950511,-83.854502,NA,NA,"shallow water",15,15,"racl","female","subadult",160,135,55,27.5,"y",NA,0,3,2022-04-21,"20:45:00","00:10:00","n","fotr_big_pond",35.951944,-83.854111,2022,"spring",111,81,146,113.5,NA,NA,NA,111,"spring","spring",27.956,28.744,28.35,1129.770508,NA,NA,NA,NA,1,"positive",28.35,1088.83274010609,1088.83274010609,1
"MWUT026",15,NA,35.95042,-83.854346,NA,NA,"shallow water",15,15,"racl","female","adult",200,145,77,39.5,"y",NA,0,3,2022-04-21,"20:45:00","00:10:00","n","fotr_big_pond",35.951944,-83.854111,2022,"spring",111,81,146,113.5,NA,NA,NA,111,"spring","spring",0,0,NA,NA,NA,NA,NA,NA,1,"negative",NA,NA,0,0
"MWUT027",15,NA,35.951011,-83.854823,NA,NA,"log in water",14,14,"racl","male","adult",95,55,62,31,"y",NA,0,3,2022-04-21,"20:45:00","00:10:00","n","fotr_big_pond",35.951944,-83.854111,2022,"spring",111,81,146,113.5,NA,NA,NA,111,"spring","spring",0,0,NA,NA,NA,NA,NA,NA,1,"negative",NA,NA,0,0
"MWUT028",15,NA,35.951956,-83.854495,NA,NA,"bark",13,13,"racl","male","adult",63,22,71.5,34.3,"y",NA,0,3,2022-04-21,"20:45:00","00:10:00","n","fotr_big_pond",35.951944,-83.854111,2022,"spring",111,81,146,113.5,NA,NA,NA,111,"spring","spring",0,0,NA,NA,NA,NA,NA,NA,1,"negative",NA,NA,0,0
"MWUT029",15,NA,35.952624,-83.853682,NA,NA,"stick/twigs in water",15,15,"racl","female","adult",275,200,84,39,"y",NA,0,3,2022-04-21,"20:45:00","00:10:00","n","fotr_big_pond",35.951944,-83.854111,2022,"spring",111,81,146,113.5,NA,NA,NA,111,"spring","spring",0,0,NA,NA,NA,NA,NA,NA,1,"negative",NA,NA,0,0
"MWUT030",15,NA,35.952624,-83.853682,NA,NA,"water",15,14,"racl","male","adult",115,70,68,34,"y",NA,0,3,2022-04-21,"20:45:00","00:10:00","n","fotr_big_pond",35.951944,-83.854111,2022,"spring",111,81,146,113.5,NA,NA,NA,111,"spring","spring",0,0,NA,NA,NA,NA,NA,NA,1,"negative",NA,NA,0,0
"MWUT031",18,NA,35.950418,-83.694486,NA,NA,"large shrubs, water",15,13,"raca","female","adult",290,30,131.7,61,"y",NA,0,14,2022-04-28,"20:47:00","00:30:00","n","seven_islands_wetland",35.950339,-84.694773,2022,"spring",118,118,257,187.5,NA,NA,NA,118,"summer","spring",0,0,NA,NA,NA,NA,NA,NA,1,"negative",NA,NA,0,0
"MWUT032",18,NA,35.950407,-83.6946,NA,NA,"water",17,17,"raca","female","subadult",55,25.5,61,28.5,"y",NA,0,14,2022-04-28,"20:47:00","00:30:00","n","seven_islands_wetland",35.950339,-84.694773,2022,"spring",118,118,257,187.5,NA,NA,NA,118,"summer","spring",36.854,35.932,36.393,4.325827599,NA,NA,NA,NA,1,"positive",36.393,4.11293533272847,4.11293533272847,1
"MWUT033",18,NA,35.950186,-83.694857,NA,NA,"reeds",14,14,"racl","male","adult",150,98,75,34,"y",NA,0,14,2022-04-28,"20:47:00","00:30:00","n","seven_islands_wetland",35.950339,-84.694773,2022,"spring",118,118,257,187.5,NA,NA,NA,118,"summer","spring",33.823,34.744,34.284,18.67990685,NA,NA,NA,NA,1,"positive",34.2835,17.7664585723444,17.7664585723444,1
"MWUT034",18,NA,35.950649,-83.694512,NA,NA,"mud",13,13,"raca","male","adult",260,70,109,56,"y",NA,0,14,2022-04-28,"20:47:00","00:30:00","n","seven_islands_wetland",35.950339,-84.694773,2022,"spring",118,118,257,187.5,NA,NA,NA,118,"summer","spring",0,0,NA,NA,NA,NA,NA,NA,1,"negative",NA,NA,0,0
"MWUT035",18,NA,35.95071,-83.694653,NA,NA,"reeds",13,12,"rapa","female","adult",61.5,27,60.5,32,"y",NA,0,14,2022-04-28,"20:47:00","00:30:00","n","seven_islands_wetland",35.950339,-84.694773,2022,"spring",118,118,257,187.5,NA,NA,NA,118,"summer","spring",0,0,NA,NA,NA,NA,NA,NA,1,"negative",NA,NA,0,0
"MWUT036",18,NA,35.95016,-83.69453,NA,NA,"reeds",17,15,"raca","male","adult",230,50,120,56,"y",NA,0,14,2022-04-28,"20:47:00","00:30:00","n","seven_islands_wetland",35.950339,-84.694773,2022,"spring",118,118,257,187.5,NA,NA,NA,118,"summer","spring",0,0,NA,NA,NA,NA,NA,NA,1,"negative",NA,NA,0,0
"MWUT037",18,NA,35.949999,-83.694777,NA,NA,"shallow water",17,14,"raca",NA,"subadult",66.5,46.5,52.5,22.5,"y",NA,0,14,2022-04-28,"20:47:00","00:30:00","n","seven_islands_wetland",35.950339,-84.694773,2022,"spring",118,118,257,187.5,NA,NA,NA,118,"summer","spring",34.36,35.146,34.753,13.30466461,NA,NA,NA,NA,1,"positive",34.753,12.828397994178,12.828397994178,1
"MWUT038",18,NA,35.949982,-83.694574,NA,NA,"water, reeds",18,16,"raca","female","adult",230.5,60,119,50,"y",NA,0,14,2022-04-28,"20:47:00","00:30:00","n","seven_islands_wetland",35.950339,-84.694773,2022,"spring",118,118,257,187.5,NA,NA,NA,118,"summer","spring",0,0,NA,NA,NA,NA,NA,NA,1,"negative",NA,NA,0,0
"MWUT039",18,NA,35.950388,-83.694574,NA,NA,"reeds",13,11,"raca",NA,"subadult",73,56.5,50.5,22,"y",NA,0,14,2022-04-28,"20:47:00","00:30:00","n","seven_islands_wetland",35.950339,-84.694773,2022,"spring",118,118,257,187.5,NA,NA,NA,118,"summer","spring",0,0,NA,NA,NA,NA,NA,NA,1,"negative",NA,NA,0,0
"MWUT040",18,NA,35.950232,-83.694579,NA,NA,"water",16,17,"raca",NA,"subadult",110,40,77,31,"y",NA,0,14,2022-04-28,"20:47:00","00:30:00","n","seven_islands_wetland",35.950339,-84.694773,2022,"spring",118,118,257,187.5,NA,NA,NA,118,"summer","spring",30.487,29.706,30.096,336.2229614,NA,NA,NA,NA,1,"positive",30.0965,324.234642717426,324.234642717426,1
"MWUT041",18,NA,35.950192,-83.695154,NA,NA,"shallow water",13,16,"raca",NA,"subadult",95,47,69,33,"y",NA,0,14,2022-04-28,"20:47:00","00:30:00","n","seven_islands_wetland",35.950339,-84.694773,2022,"spring",118,118,257,187.5,NA,NA,NA,118,"summer","spring",0,0,NA,NA,NA,NA,NA,NA,1,"negative",NA,NA,0,0
"MWUT042",18,NA,35.950192,-83.695154,NA,NA,"shallow water",14,15,"raca",NA,"subadult",86.5,59,63,27,"y",NA,0,14,2022-04-28,"20:47:00","00:30:00","n","seven_islands_wetland",35.950339,-84.694773,2022,"spring",118,118,257,187.5,NA,NA,NA,118,"summer","spring",0,39.212,39.212,0.581949651,0,0,NA,NA,2,"negative",39.212,0.582074753809009,0,0
"MWUT043",18,NA,35.950171,-83.694702,NA,NA,"reeds",13,12,"racl","male","adult",95,52,76,34,"y",NA,0,14,2022-04-28,"20:47:00","00:30:00","n","seven_islands_wetland",35.950339,-84.694773,2022,"spring",118,118,257,187.5,NA,NA,NA,118,"summer","spring",38.069,37.766,37.917,1.436713934,NA,NA,NA,NA,1,"positive",37.9175,1.42864273711006,1.42864273711006,1
"MWUT044",19,NA,35.933242,-83.87686,NA,NA,"bank",18,17,"raca","female","adult",275,205,83,42,"y",NA,0,15,2022-05-03,"21:01:00","00:36:00","n","william_hastie_pond",35.93335,-83.87679,2022,"spring",123,123,255,189,NA,NA,NA,123,"summer","summer",0,0,NA,NA,NA,NA,NA,NA,1,"negative",NA,NA,0,0
"MWUT045",19,NA,35.933371,-83.87663,NA,NA,"bank",17,17,"raca",NA,"subadult",315,295,46.5,21,"y",NA,0,15,2022-05-03,"21:01:00","00:36:00","n","william_hastie_pond",35.93335,-83.87679,2022,"spring",123,123,255,189,NA,NA,NA,123,"summer","summer",31.174,31.101,31.137,157.5848846,NA,NA,NA,NA,1,"positive",31.1375,157.498659712437,157.498659712437,1
"MWUT046",19,NA,35.933222,-83.876967,NA,NA,"bank",16,16,"racl","male","adult",73,32,66.5,34,"y",NA,0,15,2022-05-03,"21:01:00","00:36:00","n","william_hastie_pond",35.93335,-83.87679,2022,"spring",123,123,255,189,NA,NA,NA,123,"summer","summer",32.357,32.65,32.504,61.38131714,NA,NA,NA,NA,1,"positive",32.5035,61.0652159175772,61.0652159175772,1
"MWUT047",19,NA,35.933215,-83.877123,NA,NA,"shallow water",17,17,"raca","female","adult",215,125,94,46,"y",NA,0,15,2022-05-03,"21:01:00","00:36:00","n","william_hastie_pond",35.93335,-83.87679,2022,"spring",123,123,255,189,NA,NA,NA,123,"summer","summer",28.833,28.776,28.805,794.539978,NA,NA,NA,NA,1,"positive",28.8045,794.421902752178,794.421902752178,1
"MWUT048",19,NA,35.933337,-83.8766629,NA,NA,"bank",17,17,"raca","female","adult",250,145,84,46,"y",NA,0,15,2022-05-03,"21:01:00","00:36:00","n","william_hastie_pond",35.93335,-83.87679,2022,"spring",123,123,255,189,NA,NA,NA,123,"summer","summer",0,0,NA,NA,NA,NA,NA,NA,1,"negative",NA,NA,0,0
"MWUT049",19,NA,35.933194,-83.877089,NA,NA,"bank",18,18,"raca","male","adult",245,105,93.5,46,"y",NA,0,15,2022-05-03,"21:01:00","00:36:00","n","william_hastie_pond",35.93335,-83.87679,2022,"spring",123,123,255,189,NA,NA,NA,123,"summer","summer",34.876,34.511,34.693,13.47902107,NA,NA,NA,NA,1,"positive",34.6935,13.3689017479954,13.3689017479954,1
"MWUT050",19,NA,35.933279,-83.877147,NA,NA,"bank",17,17,"raca","female","adult",165,95,83,40,"y",NA,0,15,2022-05-03,"21:01:00","00:36:00","n","william_hastie_pond",35.93335,-83.87679,2022,"spring",123,123,255,189,NA,NA,NA,123,"summer","summer",37.579,36.92,37.249,2.330328465,NA,NA,NA,NA,1,"positive",37.2495,2.27063140233174,2.27063140233174,1
"MWUT051",19,NA,35.933203,-83.877103,NA,NA,"bank",18,17,"raca","male","adult",205,105,84,46.5,"y",NA,0,15,2022-05-03,"21:01:00","00:36:00","n","william_hastie_pond",35.93335,-83.87679,2022,"spring",123,123,255,189,NA,NA,NA,123,"summer","summer",33.466,33.296,33.381,33.29097748,NA,NA,NA,NA,1,"positive",33.381,33.2248311702092,33.2248311702092,1
"MWUT052",19,NA,35.933197,-83.877083,NA,NA,"bank",17,18,"raca","male","adult",155,45,94,49,"y",NA,0,15,2022-05-03,"21:01:00","00:36:00","n","william_hastie_pond",35.93335,-83.87679,2022,"spring",123,123,255,189,NA,NA,NA,123,"summer","summer",0,0,NA,NA,NA,NA,NA,NA,1,"negative",NA,NA,0,0
"MWUT053",19,NA,35.933207,-83.877111,NA,NA,"shallow water",18,18,"raca","male","adult",215,95,94,48,"y",NA,0,15,2022-05-03,"21:01:00","00:36:00","n","william_hastie_pond",35.93335,-83.87679,2022,"spring",123,123,255,189,NA,NA,NA,123,"summer","summer",37.287,36.927,37.107,2.526148319,NA,NA,NA,NA,1,"positive",37.107,2.50652595062092,2.50652595062092,1
"MWUT054",19,NA,35.933281,-83.877172,NA,NA,"log",18,18,"raca","female","adult",235,120,95,47,"y",NA,0,15,2022-05-03,"21:01:00","00:36:00","n","william_hastie_pond",35.93335,-83.87679,2022,"spring",123,123,255,189,NA,NA,NA,123,"summer","summer",0,0,NA,NA,NA,NA,NA,NA,1,"negative",NA,NA,0,0
"MWUT055",19,NA,35.933434,-83.876953,NA,NA,"leaves;terresterial",16,16,"racl","male","adult",310,270,69,33,"y",NA,0,15,2022-05-03,"21:01:00","00:36:00","n","william_hastie_pond",35.93335,-83.87679,2022,"spring",123,123,255,189,NA,NA,NA,123,"summer","summer",0,0,NA,NA,NA,NA,NA,NA,1,"negative",NA,NA,0,0
"MWUT056",19,NA,35.933355,-83.877316,NA,NA,"leaves;terresterial",16,16,"racl","female","adult",250,210,64.5,31.5,"y",NA,0,15,2022-05-03,"21:01:00","00:36:00","n","william_hastie_pond",35.93335,-83.87679,2022,"spring",123,123,255,189,NA,NA,NA,123,"summer","summer",0,0,NA,NA,NA,NA,NA,NA,1,"negative",NA,NA,0,0
"MWUT057",19,NA,35.933252,-83.87727,NA,NA,"bank",18,18,"racl","male","adult",210,155,71,35,"y",NA,0,15,2022-05-03,"21:01:00","00:36:00","n","william_hastie_pond",35.93335,-83.87679,2022,"spring",123,123,255,189,NA,NA,NA,123,"summer","summer",0,0,NA,NA,NA,NA,NA,NA,1,"negative",NA,NA,0,0
"MWUT058",19,NA,35.933384,-83.877002,NA,NA,"bank",16,16,"racl","female","adult",170,120,68,33,"y",NA,0,15,2022-05-03,"21:01:00","00:36:00","n","william_hastie_pond",35.93335,-83.87679,2022,"spring",123,123,255,189,NA,NA,NA,123,"summer","summer",0,0,NA,NA,NA,NA,NA,NA,1,"negative",NA,NA,0,0
"MWUT059",19,NA,35.933543,-83.877497,NA,NA,"shallow water",18,20,"racl","female","adult",285,220,77,35,"y",NA,0,15,2022-05-03,"21:01:00","00:36:00","n","william_hastie_pond",35.93335,-83.87679,2022,"spring",123,123,255,189,NA,NA,NA,123,"summer","summer",0,39.741,39.741,0.40319851,36.209,37.288,36.749,3.441966534,2,"positive",37.746,1.60910703055498,1.60910703055498,1
"MWUT060",19,NA,35.933543,-83.877497,NA,NA,"shallow water",18,18,"racl","female","adult",195,130,78,37,"y",NA,0,15,2022-05-03,"21:01:00","00:36:00","n","william_hastie_pond",35.93335,-83.87679,2022,"spring",123,123,255,189,NA,NA,NA,123,"summer","summer",0,0,NA,NA,NA,NA,NA,NA,1,"negative",NA,NA,0,0
"MWUT061",19,NA,35.933508,-83.877402,NA,NA,"shallow water",17,17,"raca",NA,"subadult",110,90,53.5,23,"y",NA,0,15,2022-05-03,"21:01:00","00:36:00","n","william_hastie_pond",35.93335,-83.87679,2022,"spring",123,123,255,189,NA,NA,NA,123,"summer","summer",33.609,31.555,32.582,73.14076996,NA,NA,NA,NA,1,"positive",32.582,57.8291996791258,57.8291996791258,1
"MWUT062",19,NA,35.933432,-83.87679,NA,NA,"tree",17,17,"pscr","male","adult",28,26,24,8.5,"y",NA,0,15,2022-05-03,"21:01:00","00:36:00","n","william_hastie_pond",35.93335,-83.87679,2022,"spring",123,123,255,189,NA,NA,NA,123,"summer","summer",0,38.801,38.801,0.77393651,0,39.64,39.64,0.432560921,2,"positive",39.2205,0.578653108943053,0.578653108943053,1
"MWUT063",19,NA,35.933276,-83.87665,NA,NA,"tree",19,19,"pscr","male","adult",11,9,19,8.5,"y",NA,0,15,2022-05-03,"21:01:00","00:36:00","n","william_hastie_pond",35.93335,-83.87679,2022,"spring",123,123,255,189,NA,NA,NA,123,"summer","summer",38.4,36.961,37.68,1.8983953,NA,NA,NA,NA,1,"positive",37.6805,1.68389741767061,1.68389741767061,1
"MWUT064",20,NA,35.935638,-83.939817,NA,NA,"shallow water",19,19,"racl","male","adult",140,83,81,38.5,"y",NA,0,2,2022-05-05,"21:00:00","23:01:00","n","cherokee_woodlot_wetlands",35.935746,-83.939972,2022,"spring",125,76,262,169,NA,NA,NA,125,"summer","summer",0,0,NA,NA,NA,NA,NA,NA,1,"negative",NA,NA,0,0
"MWUT065",20,NA,35.935577,-83.939837,NA,NA,"water",19,18,"racl","female","adult",135,70,76,36,"y",NA,0,2,2022-05-05,"21:00:00","23:01:00","n","cherokee_woodlot_wetlands",35.935746,-83.939972,2022,"spring",125,76,262,169,NA,NA,NA,125,"summer","summer",0,0,NA,NA,NA,NA,NA,NA,1,"negative",NA,NA,0,0
"MWUT066",20,NA,35.935582,-83.939844,NA,NA,"ponds edge",18,17,"racl","male","adult",123,75,71,33,"y",NA,0,2,2022-05-05,"21:00:00","23:01:00","n","cherokee_woodlot_wetlands",35.935746,-83.939972,2022,"spring",125,76,262,169,NA,NA,NA,125,"summer","summer",0,0,NA,NA,NA,NA,NA,NA,1,"negative",NA,NA,0,0
"MWUT067",20,NA,35.935582,-83.939843,NA,NA,"ponds edge",16,17,"racl","male","adult",145,75,79,37,"y",NA,0,2,2022-05-05,"21:00:00","23:01:00","n","cherokee_woodlot_wetlands",35.935746,-83.939972,2022,"spring",125,76,262,169,NA,NA,NA,125,"summer","summer",35.198,36.24,35.719,6.99770546,NA,NA,NA,NA,1,"positive",35.719,6.56420711462001,6.56420711462001,1
"MWUT068",20,NA,35.935665,-83.939831,NA,NA,"ponds edge",18,19,"racl","male","adult",83,31,74,37,"y",NA,0,2,2022-05-05,"21:00:00","23:01:00","n","cherokee_woodlot_wetlands",35.935746,-83.939972,2022,"spring",125,76,262,169,NA,NA,NA,125,"summer","summer",0,0,NA,NA,NA,NA,NA,NA,1,"negative",NA,NA,0,0
"MWUT069",20,NA,35.935646,-83.93986,NA,NA,"water; reeds",19,19,"racl","female","adult",100,48,65,35,"y",NA,0,2,2022-05-05,"21:00:00","23:01:00","n","cherokee_woodlot_wetlands",35.935746,-83.939972,2022,"spring",125,76,262,169,NA,NA,NA,125,"summer","summer",0,0,NA,NA,NA,NA,NA,NA,1,"negative",NA,NA,0,0
"MWUT070",20,NA,35.935659,-83.939773,NA,NA,"ponds edge",19,19,"racl","female","adult",195,125,76,36,"y",NA,0,2,2022-05-05,"21:00:00","23:01:00","n","cherokee_woodlot_wetlands",35.935746,-83.939972,2022,"spring",125,76,262,169,NA,NA,NA,125,"summer","summer",33.97,34.639,34.305,17.98171997,NA,NA,NA,NA,1,"positive",34.3045,17.5095504024861,17.5095504024861,1
"MWUT071",20,NA,35.935653,-83.939822,NA,NA,"bank",19,18,"racl","male","adult",205,145,76.5,34,"y",NA,0,2,2022-05-05,"21:00:00","23:01:00","n","cherokee_woodlot_wetlands",35.935746,-83.939972,2022,"spring",125,76,262,169,NA,NA,NA,125,"summer","summer",0,0,NA,NA,NA,NA,NA,NA,1,"negative",NA,NA,0,0
"MWUT072",20,NA,35.935576,-83.939838,NA,NA,"ponds edge",19,19,"racl","male","adult",165,110,66,35,"y",NA,0,2,2022-05-05,"21:00:00","23:01:00","n","cherokee_woodlot_wetlands",35.935746,-83.939972,2022,"spring",125,76,262,169,NA,NA,NA,125,"summer","summer",0,0,NA,NA,NA,NA,NA,NA,1,"negative",NA,NA,0,0
"MWUT073",21,NA,35.915297,-84.403139,NA,NA,"bank",18,19,"racl","female","adult",110,62,75,34,"y",NA,0,1,2022-05-24,"21:00:00","23:30:00","n","ornl_powerhouse",35.914888,-84.4000154,2022,"spring",144,74,264,169,NA,NA,NA,144,"summer","summer",0,0,NA,NA,NA,NA,NA,NA,1,"negative",NA,NA,0,0
"MWUT074",21,NA,35.915342,-84.402907,NA,NA,"bank",20,21,"racl","male","adult",278,240,60.5,31.5,"y",NA,0,1,2022-05-24,"21:00:00","23:30:00","n","ornl_powerhouse",35.914888,-84.4000154,2022,"spring",144,74,264,169,NA,NA,NA,144,"summer","summer",0,0,NA,NA,NA,NA,NA,NA,1,"negative",NA,NA,0,0
"MWUT075",21,NA,35.915789,-84.403159,NA,NA,"terrestrial",18,18,"racl","male","adult",170,130,62,28.5,"y",NA,0,1,2022-05-24,"21:00:00","23:30:00","n","ornl_powerhouse",35.914888,-84.4000154,2022,"spring",144,74,264,169,NA,NA,NA,144,"summer","summer",0,0,NA,NA,NA,NA,NA,NA,1,"negative",NA,NA,0,0
"MWUT076",21,NA,35.915828,-84.403427,NA,NA,"bank",18,18,"racl","male","adult",155,125,64.5,31,"y",NA,0,1,2022-05-24,"21:00:00","23:30:00","n","ornl_powerhouse",35.914888,-84.4000154,2022,"spring",144,74,264,169,NA,NA,NA,144,"summer","summer",0,0,NA,NA,NA,NA,NA,NA,1,"negative",NA,NA,0,0
"MWUT077",21,NA,35.915793,-84.403492,NA,NA,"terrestrial",19,19,"racl","female","adult",165,135,62,35,"y",NA,0,1,2022-05-24,"21:00:00","23:30:00","n","ornl_powerhouse",35.914888,-84.4000154,2022,"spring",144,74,264,169,NA,NA,NA,144,"summer","summer",0,0,NA,NA,NA,NA,NA,NA,1,"negative",NA,NA,0,0
"MWUT078",21,NA,35.915813,-84.403043,NA,NA,"water; reed",19,19,"racl","male","adult",135,90,62,33.5,"y",NA,0,1,2022-05-24,"21:00:00","23:30:00","n","ornl_powerhouse",35.914888,-84.4000154,2022,"spring",144,74,264,169,NA,NA,NA,144,"summer","summer",0,0,NA,NA,NA,NA,NA,NA,1,"negative",NA,NA,0,0
"MWUT079",21,NA,35.915832,-84.402886,NA,NA,"water; shrub",19,20,"racl","male","adult",205,167,60,31.5,"y",NA,0,1,2022-05-24,"21:00:00","23:30:00","n","ornl_powerhouse",35.914888,-84.4000154,2022,"spring",144,74,264,169,NA,NA,NA,144,"summer","summer",38.184,38.205,38.195,1.178705931,NA,NA,NA,NA,1,"positive",38.1945,1.17891464536167,1.17891464536167,1
"MWUT080",21,NA,35.915869,-84.403401,NA,NA,"water;sticks",19,19,"racl",NA,"subadult",23,17,31.5,15,"y",NA,0,1,2022-05-24,"21:00:00","23:30:00","n","ornl_powerhouse",35.914888,-84.4000154,2022,"spring",144,74,264,169,NA,NA,NA,144,"summer","summer",0,0,NA,NA,NA,NA,NA,NA,1,"negative",NA,NA,0,0
"MWUT081",21,NA,35.915863,-84.40343,NA,NA,"water;algae",19,19,"racl",NA,"subadult",35,30.5,26.5,10.5,"y",NA,0,1,2022-05-24,"21:00:00","23:30:00","n","ornl_powerhouse",35.914888,-84.4000154,2022,"spring",144,74,264,169,NA,NA,NA,144,"summer","summer",0,0,NA,NA,NA,NA,NA,NA,1,"negative",NA,NA,0,0
"MWUT082",21,NA,35.915816,-84.402937,NA,NA,"bank;rocks",19,19,"racl","male","adult",255,210,65,31,"y",NA,0,1,2022-05-24,"21:00:00","23:30:00","n","ornl_powerhouse",35.914888,-84.4000154,2022,"spring",144,74,264,169,NA,NA,NA,144,"summer","summer",0,0,NA,NA,NA,NA,NA,NA,1,"negative",NA,NA,0,0
"MWUT083",22,NA,35.951367,-83.854843,NA,NA,"water;not submerged;log",19,19,"racl","male","subadult",160,150,36,15,"y",NA,0,3,2022-05-26,"21:00:00","23:55:00","n","fotr_big_pond",35.951944,-83.854111,2022,"spring",146,81,146,113.5,NA,NA,NA,146,"summer","summer",0,0,NA,NA,NA,NA,NA,NA,1,"negative",NA,NA,0,0
"MWUT084",22,NA,35.951519,-83.854919,NA,NA,"bank",17,17,"racl","male","adult",80,50,72,30.7,"y",NA,0,3,2022-05-26,"21:00:00","23:55:00","n","fotr_big_pond",35.951944,-83.854111,2022,"spring",146,81,146,113.5,NA,NA,NA,146,"summer","summer",0,0,NA,NA,NA,NA,NA,NA,1,"negative",NA,NA,0,0
"MWUT085",22,NA,35.95148,-83.854802,NA,NA,"water;not submerged;log",19,19,"racl","male","adult",210,160,74.5,35,"y",NA,0,3,2022-05-26,"21:00:00","23:55:00","n","fotr_big_pond",35.951944,-83.854111,2022,"spring",146,81,146,113.5,NA,NA,NA,146,"summer","summer",0,0,NA,NA,NA,NA,NA,NA,1,"negative",NA,NA,0,0
"MWUT086",22,NA,35.951401,-83.854866,NA,NA,"bank",17,18,"racl","male","adult",130,75,74,36,"y",NA,0,3,2022-05-26,"21:00:00","23:55:00","n","fotr_big_pond",35.951944,-83.854111,2022,"spring",146,81,146,113.5,NA,NA,NA,146,"summer","summer",0,0,NA,NA,NA,NA,NA,NA,1,"negative",NA,NA,0,0
"MWUT087",22,NA,35.9515,-83.854941,NA,NA,"bank",17,17,"racl",NA,"subadult",30,20,37,16.5,"y",NA,0,3,2022-05-26,"21:00:00","23:55:00","n","fotr_big_pond",35.951944,-83.854111,2022,"spring",146,81,146,113.5,NA,NA,NA,146,"summer","summer",0,0,NA,NA,NA,NA,NA,NA,1,"negative",NA,NA,0,0
"MWUT088",22,NA,35.951229,-83.854896,NA,NA,"bank",17,17,"racl","male","adult",160,110,71,31,"y",NA,0,3,2022-05-26,"21:00:00","23:55:00","n","fotr_big_pond",35.951944,-83.854111,2022,"spring",146,81,146,113.5,NA,NA,NA,146,"summer","summer",0,0,NA,NA,NA,NA,NA,NA,1,"negative",NA,NA,0,0
"MWUT089",22,NA,35.951134,-83.854753,NA,NA,"water;not submerged;log",19,19,"racl",NA,"subadult",200,190,34.5,16,"y",NA,0,3,2022-05-26,"21:00:00","23:55:00","n","fotr_big_pond",35.951944,-83.854111,2022,"spring",146,81,146,113.5,NA,NA,NA,146,"summer","summer",0,0,NA,NA,NA,NA,NA,NA,1,"negative",NA,NA,0,0
"MWUT090",22,NA,35.950984,-83.85489,NA,NA,"edge;mostly submerged",18,18,"racl","male","adult",140,110,68,31,"y",NA,0,3,2022-05-26,"21:00:00","23:55:00","n","fotr_big_pond",35.951944,-83.854111,2022,"spring",146,81,146,113.5,NA,NA,NA,146,"summer","summer",0,0,NA,NA,NA,NA,NA,NA,1,"negative",NA,NA,0,0
"MWUT091",22,NA,35.951022,-83.854848,NA,NA,"water;not submerged;log",18,18,"racl",NA,"subadult",31,23,33.5,15.5,"y",NA,0,3,2022-05-26,"21:00:00","23:55:00","n","fotr_big_pond",35.951944,-83.854111,2022,"spring",146,81,146,113.5,NA,NA,NA,146,"summer","summer",0,0,NA,NA,NA,NA,NA,NA,1,"negative",NA,NA,0,0
"MWUT092",22,NA,35.951019,-83.854828,NA,NA,"water;mostly submerged",18,18,"racl","male","adult",165,120,68,34,"y",NA,0,3,2022-05-26,"21:00:00","23:55:00","n","fotr_big_pond",35.951944,-83.854111,2022,"spring",146,81,146,113.5,NA,NA,NA,146,"summer","summer",0,0,NA,NA,NA,NA,NA,NA,1,"negative",NA,NA,0,0
"MWUT093",22,NA,35.95208,-83.853641,NA,NA,"water;mostly submerged",20,20,"raca","female","adult",265,85,113,54,"y",NA,0,3,2022-05-26,"21:00:00","23:55:00","n","fotr_big_pond",35.951944,-83.854111,2022,"spring",146,81,146,113.5,NA,NA,NA,146,"summer","summer",0,0,NA,NA,NA,NA,NA,NA,1,"negative",NA,NA,0,0
"MWUT094",22,NA,35.952677,-83.853681,NA,NA,"water; mostly submerged",21,20,"racl",NA,"subadult",26.5,17.5,35,17,"y",NA,0,3,2022-05-26,"21:00:00","23:55:00","n","fotr_big_pond",35.951944,-83.854111,2022,"spring",146,81,146,113.5,NA,NA,NA,146,"summer","summer",0,0,NA,NA,NA,NA,NA,NA,1,"negative",NA,NA,0,0
"MWUT096",22,NA,35.952614,-83.853637,NA,NA,"water;not submerged",21,19,"racl","male","adult",200,140,68,33.5,"y",NA,0,3,2022-05-26,"21:00:00","23:55:00","n","fotr_big_pond",35.951944,-83.854111,2022,"spring",146,81,146,113.5,NA,NA,NA,146,"summer","summer",0,0,NA,NA,NA,NA,NA,NA,1,"negative",NA,NA,0,0
"MWUT097",22,NA,35.952721,-83.853701,NA,NA,"terrestrial",18,18,"racl","female","adult",140,85,72.5,44,"y",NA,0,3,2022-05-26,"21:00:00","23:55:00","n","fotr_big_pond",35.951944,-83.854111,2022,"spring",146,81,146,113.5,NA,NA,NA,146,"summer","summer",0,0,NA,NA,NA,NA,NA,NA,1,"negative",NA,NA,0,0
"MWUT098",24,NA,35.955105,-83.851294,NA,NA,"terrestrial",NA,NA,"pscr","male","adult",20.5,18,22,8,"y",NA,0,5,2022-05-27,"00:20:00","01:00:00","n","fotr_two_pence",35.955091,-83.851316,2022,"spring",147,81,147,114,NA,NA,NA,147,"summer","summer",0,0,NA,NA,NA,NA,NA,NA,1,"negative",NA,NA,0,0
"MWUT099",24,NA,35.955158,-83.85112,NA,NA,"water;not submerged;sticks",19,18,"racl",NA,"subadult",64,53,32,15,"y",NA,0,5,2022-05-27,"00:20:00","01:00:00","n","fotr_two_pence",35.955091,-83.851316,2022,"spring",147,81,147,114,NA,NA,NA,147,"summer","summer",0,0,NA,NA,NA,NA,NA,NA,1,"negative",NA,NA,0,0
"MWUT100",24,NA,35.955223,-83.851191,NA,NA,"terrestrial;tree",16,17,"pscr","male","adult",14,12,23,9,"y",NA,0,5,2022-05-27,"00:20:00","01:00:00","n","fotr_two_pence",35.955091,-83.851316,2022,"spring",147,81,147,114,NA,NA,NA,147,"summer","summer",0,0,NA,NA,NA,NA,NA,NA,1,"negative",NA,NA,0,0
"MWUT1000",127,NA,35.95780464,-83.86926323,NA,"8/23/2023 21:08","water;fully submerged",26.4,26.4,"novi",NA,"larva",62,53.5,37.2,NA,"y",NA,6,10,2023-08-23,"20:22:00","23:59:00","n","ijams_complex_pond3",35.957797,-83.869251,2023,"summer",235,227,235,231,227,229,228,231,"autumn","summer",0,0,NA,NA,NA,NA,NA,NA,1,"negative",NA,NA,0,0
"MWUT1001",128,NA,35.95614428,-83.86680638,NA,"8/23/2023 23:04","water;fully submerged",27,26,"novi","female","adult",86,80,46.7,NA,"y",NA,6,16,2023-08-23,"20:22:00","23:59:00","n","ijams_visitor_center_pond",35.956094,-83.866773,2023,"summer",235,227,235,231,227,229,228,231,"autumn","summer",0,0,NA,NA,NA,NA,NA,NA,1,"negative",NA,NA,0,0
"MWUT1002",128,NA,35.95615958,-83.86680114,NA,"8/23/2023 22:53","edge;fully submerged",25,25,"novi","female","adult",94,91,45,NA,"y",NA,6,16,2023-08-23,"20:22:00","23:59:00","n","ijams_visitor_center_pond",35.956094,-83.866773,2023,"summer",235,227,235,231,227,229,228,231,"autumn","summer",0,0,NA,NA,NA,NA,NA,NA,1,"negative",NA,NA,0,0
"MWUT1003",128,NA,35.95624123,-83.86659647,NA,"8/23/2023 23:10","bank",25,25,"racl","male","adult",55.5,20.5,67.4,36.1,"y",NA,6,16,2023-08-23,"20:22:00","23:59:00","n","ijams_visitor_center_pond",35.956094,-83.866773,2023,"summer",235,227,235,231,227,229,228,231,"autumn","summer",0,0,NA,NA,NA,NA,NA,NA,1,"negative",NA,NA,0,0
"MWUT1004",128,NA,35.95609516,-83.86675995,NA,"8/23/2023 22:44","edge;not submerged",24,26,"racl","male","adult",75,41,67.9,35.3,"y",NA,6,16,2023-08-23,"20:22:00","23:59:00","n","ijams_visitor_center_pond",35.956094,-83.866773,2023,"summer",235,227,235,231,227,229,228,231,"autumn","summer",35.372,34.642,35.007,11.10353088,NA,NA,NA,NA,1,"positive",35.007,10.7562153168743,10.7562153168743,1
"MWUT1005",128,NA,35.95622753,-83.86664521,NA,"8/23/2023 22:40","bank",25,24,"racl","male","adult",58,19,71.2,37.9,"y",NA,6,16,2023-08-23,"20:22:00","23:59:00","n","ijams_visitor_center_pond",35.956094,-83.866773,2023,"summer",235,227,235,231,227,229,228,231,"autumn","summer",33.967,33.623,33.795,25.11509323,NA,NA,NA,NA,1,"positive",33.795,24.9317474287694,24.9317474287694,1
"MWUT1006",128,NA,35.95615862,-83.86677399,NA,"8/23/2023 22:49","edge;fully submerged",26,24,"novi","male","adult",71,66,48.3,NA,"y",NA,6,16,2023-08-23,"20:22:00","23:59:00","n","ijams_visitor_center_pond",35.956094,-83.866773,2023,"summer",235,227,235,231,227,229,228,231,"autumn","summer",0,12.967,12.967,46873092,0,0,NA,NA,2,"negative",12.967,46861223.967315,0,0
"MWUT1007",128,NA,35.9562535,-83.86669679,NA,"8/23/2023 23:02","edge;mostly submerged",25,25,"racl","male","adult",48.5,14,72.3,39,"y",NA,6,16,2023-08-23,"20:22:00","23:59:00","n","ijams_visitor_center_pond",35.956094,-83.866773,2023,"summer",235,227,235,231,227,229,228,231,"autumn","summer",0,0,NA,NA,NA,NA,NA,NA,1,"negative",NA,NA,0,0
"MWUT1008",128,NA,35.95619817,-83.86670496,NA,"8/23/2023 22:50","water;mostly submerged",25.2,25.3,"racl","male","adult",56,21,67.9,37.4,"y",NA,6,16,2023-08-23,"20:22:00","23:59:00","n","ijams_visitor_center_pond",35.956094,-83.866773,2023,"summer",235,227,235,231,227,229,228,231,"autumn","summer",0,0,NA,NA,NA,NA,NA,NA,1,"negative",NA,NA,0,0
"MWUT1009",128,NA,35.95616091,-83.86659135,NA,"8/23/2023 22:40","bank",24.8,24.8,"racl","male","adult",55,22,66.7,37.8,"y",NA,6,16,2023-08-23,"20:22:00","23:59:00","n","ijams_visitor_center_pond",35.956094,-83.866773,2023,"summer",235,227,235,231,227,229,228,231,"autumn","summer",0,0,NA,NA,NA,NA,NA,NA,1,"negative",NA,NA,0,0
"MWUT101",24,NA,35.955159,-83.85127,NA,NA,"terrestrial;leaf",16,18,"pscr","male","adult",16,12,20,9,"y",NA,0,5,2022-05-27,"00:20:00","01:00:00","n","fotr_two_pence",35.955091,-83.851316,2022,"spring",147,81,147,114,NA,NA,NA,147,"summer","summer",0,0,NA,NA,NA,NA,NA,NA,1,"negative",NA,NA,0,0
"MWUT1010",128,NA,35.95617452,-83.86666349,NA,"8/23/2023 22:53","bank",25.1,24.8,"racl","male","adult",58,29,69,34.8,"y",NA,6,16,2023-08-23,"20:22:00","23:59:00","n","ijams_visitor_center_pond",35.956094,-83.866773,2023,"summer",235,227,235,231,227,229,228,231,"autumn","summer",0,0,NA,NA,NA,NA,NA,NA,1,"negative",NA,NA,0,0
"MWUT1011",128,NA,35.95611718,-83.86666599,NA,"8/23/2023 23:04","edge;fully submerged",26,26,"novi","female","adult",24.5,22,39,NA,"y",NA,6,16,2023-08-23,"20:22:00","23:59:00","n","ijams_visitor_center_pond",35.956094,-83.866773,2023,"summer",235,227,235,231,227,229,228,231,"autumn","summer",0,0,NA,NA,NA,NA,NA,NA,1,"negative",NA,NA,0,0
"MWUT1012",129,NA,35.93314614,-83.87701152,NA,"8/24/2023 20:54","terrestrial",25,25,"racl","male","adult",61,10,80.6,43.5,"y",NA,6,15,2023-08-24,"20:28:00","23:19:00","n","william_hastie_pond",35.93335,-83.87679,2023,"summer",236,236,243,239.5,241,243,242,239.5,"autumn","summer",0,0,NA,NA,NA,NA,NA,NA,1,"negative",NA,NA,0,0
"MWUT1013",129,NA,35.93338757,-83.87670951,NA,"8/24/2023 20:44","bank",24.2,24.1,"racl","male","adult",41.5,10,70.8,37.1,"y",NA,6,15,2023-08-24,"20:28:00","23:19:00","n","william_hastie_pond",35.93335,-83.87679,2023,"summer",236,236,243,239.5,241,243,242,239.5,"autumn","summer",39.302,37.859,38.581,1.017305136,NA,NA,NA,NA,1,"positive",38.5805,0.902000536373724,0.902000536373724,1
"MWUT1014",129,NA,35.93336362,-83.87674045,NA,"8/24/2023 21:40","water;not submerged",23.7,23.5,"raca",NA,"subadult",51,35,53,27.6,"y",NA,6,15,2023-08-24,"20:28:00","23:19:00","n","william_hastie_pond",35.93335,-83.87679,2023,"summer",236,236,243,239.5,241,243,242,239.5,"autumn","summer",24.489,24.508,24.499,15743.74219,NA,NA,NA,NA,1,"positive",24.4985,15745.4968564152,15745.4968564152,1
"MWUT1015",129,NA,35.93332459,-83.87681957,NA,"8/24/2023 20:58","bank",25,25,"racl",NA,"subadult",15,13,20.5,8.3,"y",NA,6,15,2023-08-24,"20:28:00","23:19:00","n","william_hastie_pond",35.93335,-83.87679,2023,"summer",236,236,243,239.5,241,243,242,239.5,"autumn","summer",36.157,35.521,35.839,6.186994553,NA,NA,NA,NA,1,"positive",35.839,6.03996512259936,6.03996512259936,1
"MWUT1016",129,NA,35.93338463,-83.87698855,NA,"8/24/2023 21:03","bank",23,24,"raca","female","adult",100,21,85.6,46.9,"y",NA,6,15,2023-08-24,"20:28:00","23:19:00","n","william_hastie_pond",35.93335,-83.87679,2023,"summer",236,236,243,239.5,241,243,242,239.5,"autumn","summer",30.666,30.925,30.795,200.4771729,NA,NA,NA,NA,1,"positive",30.7955,199.663288478519,199.663288478519,1
"MWUT1017",129,NA,35.9334355,-83.87667702,NA,"8/24/2023 20:51","bank",24,24,"racl","male","adult",70.5,28,73.8,37.1,"y",NA,6,15,2023-08-24,"20:28:00","23:19:00","n","william_hastie_pond",35.93335,-83.87679,2023,"summer",236,236,243,239.5,241,243,242,239.5,"autumn","summer",0,0,NA,NA,NA,NA,NA,NA,1,"negative",NA,NA,0,0
"MWUT1018",129,NA,35.9331963,-83.8768328,NA,"8/24/2023 21:23","terrestrial",24,23,"racl","female","adult",104,53.5,81.1,42.1,"y",NA,6,15,2023-08-24,"20:28:00","23:19:00","n","william_hastie_pond",35.93335,-83.87679,2023,"summer",236,236,243,239.5,241,243,242,239.5,"autumn","summer",0,0,NA,NA,NA,NA,NA,NA,1,"negative",NA,NA,0,0
"MWUT1019",129,NA,35.93341801,-83.87693086,NA,"8/24/2023 21:05","bank",24.2,23.9,"raca","female","adult",180,34,107.2,53.7,"y",NA,6,15,2023-08-24,"20:28:00","23:19:00","n","william_hastie_pond",35.93335,-83.87679,2023,"summer",236,236,243,239.5,241,243,242,239.5,"autumn","summer",30.009,30.221,30.115,320.9246216,NA,NA,NA,NA,1,"positive",30.115,320.100698835197,320.100698835197,1
"MWUT102",25,NA,35.956897,-83.869836,NA,NA,"edge;mostly submerged",20,20,"racl",NA,"subadult",44,23,54.5,28,"y",NA,0,8,2022-05-30,"21:00:00","21:32:00","n","ijams_complex_pond1",35.956897,-83.869836,2022,"spring",150,83,150,116.5,NA,NA,NA,150,"summer","summer",0,0,NA,NA,NA,NA,NA,NA,1,"negative",NA,NA,0,0
"MWUT1020",129,NA,35.93326236,-83.8767569,NA,"8/24/2023 20:45","terrestrial",25,25,"racl","male","adult",45,21,62.7,33.1,"y",NA,6,15,2023-08-24,"20:28:00","23:19:00","n","william_hastie_pond",35.93335,-83.87679,2023,"summer",236,236,243,239.5,241,243,242,239.5,"autumn","summer",0,0,NA,NA,NA,NA,NA,NA,1,"negative",NA,NA,0,0
"MWUT1021",129,NA,35.93329898,-83.87703585,NA,"8/24/2023 21:27","water;mostly submerged",23.6,23.6,"raca",NA,"subadult",33,16,54.5,26,"y",NA,6,15,2023-08-24,"20:28:00","23:19:00","n","william_hastie_pond",35.93335,-83.87679,2023,"summer",236,236,243,239.5,241,243,242,239.5,"autumn","summer",33.526,33.734,33.63,28.03123474,NA,NA,NA,NA,1,"positive",33.63,27.9547752551679,27.9547752551679,1
"MWUT1022",129,NA,35.93332617,-83.87669426,NA,"8/24/2023 20:46","terrestrial",24,25,"racl","male","adult",59.5,25,67.5,35.9,"y",NA,6,15,2023-08-24,"20:28:00","23:19:00","n","william_hastie_pond",35.93335,-83.87679,2023,"summer",236,236,243,239.5,241,243,242,239.5,"autumn","summer",0,0,NA,NA,NA,NA,NA,NA,1,"negative",NA,NA,0,0
"MWUT1023",129,NA,35.93341591,-83.87685643,NA,"8/24/2023 21:20","water;mostly submerged",23.7,23.7,"racl","male","adult",88,58,67.8,37.8,"y",NA,6,15,2023-08-24,"20:28:00","23:19:00","n","william_hastie_pond",35.93335,-83.87679,2023,"summer",236,236,243,239.5,241,243,242,239.5,"autumn","summer",36.28,36.264,36.272,4.474337101,NA,NA,NA,NA,1,"positive",36.272,4.4730212143203,4.4730212143203,1
"MWUT1024",129,NA,35.93344009,-83.87681762,NA,"8/24/2023 21:01","bank",24.2,23.8,"raca",NA,"subadult",35,17,55.3,28.5,"y",NA,6,15,2023-08-24,"20:28:00","23:19:00","n","william_hastie_pond",35.93335,-83.87679,2023,"summer",236,236,243,239.5,241,243,242,239.5,"autumn","summer",0,39.385,39.385,0.51617831,0,0,NA,NA,2,"negative",39.385,0.516256604183168,0,0
"MWUT1025",129,NA,35.93345334,-83.87681524,NA,"8/24/2023 20:57","bank",24.2,24.2,"racl","male","adult",42,11,67.8,36.2,"y",NA,6,15,2023-08-24,"20:28:00","23:19:00","n","william_hastie_pond",35.93335,-83.87679,2023,"summer",236,236,243,239.5,241,243,242,239.5,"autumn","summer",0,0,NA,NA,NA,NA,NA,NA,1,"negative",NA,NA,0,0
"MWUT1026",129,NA,35.93342239,-83.87672679,NA,"8/24/2023 20:55","edge;slightly submerged",24.2,24.2,"raca","female","adult",250,30,117.6,60.1,"y",NA,6,15,2023-08-24,"20:28:00","23:19:00","n","william_hastie_pond",35.93335,-83.87679,2023,"summer",236,236,243,239.5,241,243,242,239.5,"autumn","summer",38.062,37.526,37.794,1.583403945,NA,NA,NA,NA,1,"positive",37.794,1.55641638627936,1.55641638627936,1
"MWUT1027",129,NA,35.93346832,-83.87667443,NA,"8/24/2023 21:11","bank",23.6,23.6,"racl","male","adult",86,41,74.8,40.6,"y",NA,6,15,2023-08-24,"20:28:00","23:19:00","n","william_hastie_pond",35.93335,-83.87679,2023,"summer",236,236,243,239.5,241,243,242,239.5,"autumn","summer",33.045,33.944,33.495,32.21306992,NA,NA,NA,NA,1,"positive",33.4945,30.7095142031949,30.7095142031949,1
"MWUT1028",129,NA,35.93323163,-83.87734015,NA,"8/24/2023 21:09","bank",24,23,"raca","female","adult",180,18.5,103,59.2,"y",NA,6,15,2023-08-24,"20:28:00","23:19:00","n","william_hastie_pond",35.93335,-83.87679,2023,"summer",236,236,243,239.5,241,243,242,239.5,"autumn","summer",0,0,NA,NA,NA,NA,NA,NA,1,"negative",NA,NA,0,0
"MWUT1029",129,NA,35.93328491,-83.87672799,NA,"8/24/2023 20:43","terrestrial",25,25,"racl",NA,"subadult",11.5,10,24.2,10.9,"y",NA,6,15,2023-08-24,"20:28:00","23:19:00","n","william_hastie_pond",35.93335,-83.87679,2023,"summer",236,236,243,239.5,241,243,242,239.5,"autumn","summer",0,0,NA,NA,NA,NA,NA,NA,1,"negative",NA,NA,0,0
"MWUT103",25,NA,35.956897,-83.869836,NA,NA,"edge;mostly submerged",20,20,"racl",NA,"subadult",35,22,45,20.5,"y",NA,0,8,2022-05-30,"21:00:00","21:32:00","n","ijams_complex_pond1",35.956897,-83.869836,2022,"spring",150,83,150,116.5,NA,NA,NA,150,"summer","summer",0,0,NA,NA,NA,NA,NA,NA,1,"negative",NA,NA,0,0
"MWUT1030",129,NA,35.9334562,-83.87696479,NA,"8/24/2023 20:55","water;fully submerged",24,24,"novi","female","adult",51,48,39.5,NA,"y",NA,6,15,2023-08-24,"20:28:00","23:19:00","n","william_hastie_pond",35.93335,-83.87679,2023,"summer",236,236,243,239.5,241,243,242,239.5,"autumn","summer",32.702,33.007,32.855,48.1390152,NA,NA,NA,NA,1,"positive",32.8545,47.8697821803017,47.8697821803017,1
"MWUT1031",129,NA,35.93290733,-83.87745263,NA,"8/24/2023 21:29","terrestrial",24,24,"raca",NA,"subadult",26.5,15.5,44.5,20.9,"y",NA,6,15,2023-08-24,"20:28:00","23:19:00","n","william_hastie_pond",35.93335,-83.87679,2023,"summer",236,236,243,239.5,241,243,242,239.5,"autumn","summer",0,0,NA,NA,NA,NA,NA,NA,1,"negative",NA,NA,0,0
"MWUT1032",129,NA,35.93334855,-83.87704559,NA,"8/24/2023 21:16","edge;fully submerged",24,24,"novi","male","adult",37,34.5,33,NA,"y",NA,6,15,2023-08-24,"20:28:00","23:19:00","n","william_hastie_pond",35.93335,-83.87679,2023,"summer",236,236,243,239.5,241,243,242,239.5,"autumn","summer",33.665,33.861,33.763,25.55131149,NA,NA,NA,NA,1,"positive",33.763,25.4913093781365,25.4913093781365,1
"MWUT1033",129,NA,35.9332307,-83.87685864,NA,"8/24/2023 20:59","water;fully submerged",24,24,"novi","male","adult",47.5,44.5,44.3,NA,"y",NA,6,15,2023-08-24,"20:28:00","23:19:00","n","william_hastie_pond",35.93335,-83.87679,2023,"summer",236,236,243,239.5,241,243,242,239.5,"autumn","summer",0,0,NA,NA,NA,NA,NA,NA,1,"negative",NA,NA,0,0
"MWUT1034",129,NA,35.93326479,-83.87705709,NA,"8/24/2023 21:17","edge;fully submerged",24,24,"novi","male","adult",33.5,29.5,40.4,NA,"y",NA,6,15,2023-08-24,"20:28:00","23:19:00","n","william_hastie_pond",35.93335,-83.87679,2023,"summer",236,236,243,239.5,241,243,242,239.5,"autumn","summer",34.75,34.62,34.685,13.46065807,NA,NA,NA,NA,1,"positive",34.685,13.4479536589287,13.4479536589287,1
"MWUT1035",129,NA,35.9331518,-83.87700398,NA,"8/24/2023 20:55","water;fully submerged",24,24,"novi","female","adult",51,48.5,40.1,NA,"y",NA,6,15,2023-08-24,"20:28:00","23:19:00","n","william_hastie_pond",35.93335,-83.87679,2023,"summer",236,236,243,239.5,241,243,242,239.5,"autumn","summer",33.579,32.912,33.245,37.48487473,NA,NA,NA,NA,1,"positive",33.2455,36.4988956415119,36.4988956415119,1
"MWUT1036",129,NA,35.93335976,-83.8770864,NA,"8/24/2023 21:18","edge;fully submerged",24,24,"novi","male","adult",43,39,44,NA,"y",NA,6,15,2023-08-24,"20:28:00","23:19:00","n","william_hastie_pond",35.93335,-83.87679,2023,"summer",236,236,243,239.5,241,243,242,239.5,"autumn","summer",35.968,35.484,35.726,6.625184536,NA,NA,NA,NA,1,"positive",35.726,6.53241325296054,6.53241325296054,1
"MWUT1037",129,NA,35.93329391,-83.87692896,NA,"8/24/2023 21:23","water;fully submerged",25,24,"novi","male","adult",71.5,69,44.1,NA,"y",NA,6,15,2023-08-24,"20:28:00","23:19:00","n","william_hastie_pond",35.93335,-83.87679,2023,"summer",236,236,243,239.5,241,243,242,239.5,"autumn","summer",31.459,31.357,31.408,130.6815491,NA,NA,NA,NA,1,"positive",31.408,130.555026064432,130.555026064432,1
"MWUT1038",129,NA,35.93333917,-83.87710903,NA,"8/24/2023 21:17","edge;fully submerged",24,24,"novi","female","adult",38.5,35.5,38,NA,"y",NA,6,15,2023-08-24,"20:28:00","23:19:00","n","william_hastie_pond",35.93335,-83.87679,2023,"summer",236,236,243,239.5,241,243,242,239.5,"autumn","summer",35.806,36.358,36.082,5.197369099,NA,NA,NA,NA,1,"positive",36.082,5.10311135687183,5.10311135687183,1
"MWUT1039",129,NA,35.93339476,-83.87695314,NA,"8/24/2023 20:55","edge;fully submerged",24,24,"novi","male","adult",51,47.5,44.8,NA,"y",NA,6,15,2023-08-24,"20:28:00","23:19:00","n","william_hastie_pond",35.93335,-83.87679,2023,"summer",236,236,243,239.5,241,243,242,239.5,"autumn","summer",33.688,33.913,33.801,24.91254425,NA,NA,NA,NA,1,"positive",33.8005,24.8368172860932,24.8368172860932,1
"MWUT104",25,NA,35.956897,-83.869836,NA,NA,"edge;mostly submerged",20,20,"racl",NA,"subadult",40,21.5,49.5,25.5,"y",NA,0,8,2022-05-30,"21:00:00","21:32:00","n","ijams_complex_pond1",35.956897,-83.869836,2022,"spring",150,83,150,116.5,NA,NA,NA,150,"summer","summer",34.115,33.85,33.982,21.98418808,NA,NA,NA,NA,1,"positive",33.9825,21.8913079986331,21.8913079986331,1
"MWUT1040",129,NA,35.93341164,-83.87698284,NA,"8/24/2023 20:54","edge;fully submerged",24,24,"novi","male","adult",33.5,30.5,40.1,NA,"y",NA,6,15,2023-08-24,"20:28:00","23:19:00","n","william_hastie_pond",35.93335,-83.87679,2023,"summer",236,236,243,239.5,241,243,242,239.5,"autumn","summer",0,0,NA,NA,NA,NA,NA,NA,1,"negative",NA,NA,0,0
"MWUT1041",129,NA,35.93331112,-83.87692777,NA,"8/24/2023 20:54","edge;fully submerged",24,24,"novi","male","adult",73,70.5,43.6,NA,"y",NA,6,15,2023-08-24,"20:28:00","23:19:00","n","william_hastie_pond",35.93335,-83.87679,2023,"summer",236,236,243,239.5,241,243,242,239.5,"autumn","summer",34.006,33.098,33.552,30.98263931,NA,NA,NA,NA,1,"positive",33.552,29.5088377235673,29.5088377235673,1
"MWUT1042",129,NA,35.93334584,-83.87698554,NA,"8/24/2023 21:26","water;fully submerged",25,24,"novi","female","adult",35,32,40.2,NA,"y",NA,6,15,2023-08-24,"20:28:00","23:19:00","n","william_hastie_pond",35.93335,-83.87679,2023,"summer",236,236,243,239.5,241,243,242,239.5,"autumn","summer",35.048,33.971,34.51,16.25846481,NA,NA,NA,NA,1,"positive",34.5095,15.1887637393721,15.1887637393721,1
"MWUT1043",130,NA,35.93324697,-83.87669632,NA,"8/29/2023 22:09","terrestrial",23,24,"raca",NA,"subadult",25,10,51.8,27.4,"y",NA,6,15,2023-08-29,"20:30:00","22:47:00","y","william_hastie_pond",35.93335,-83.87679,2023,"summer",241,236,243,239.5,241,243,242,239.5,"autumn","summer",30.159,30.64,30.399,266.4388733,NA,NA,NA,NA,1,"positive",30.3995,262.776247893838,262.776247893838,1
"MWUT1044",130,NA,35.93323224,-83.87722423,NA,"8/29/2023 21:51","terrestrial",22,22,"raca",NA,"subadult",28,12,53,24.3,"y",NA,6,15,2023-08-29,"20:30:00","22:47:00","y","william_hastie_pond",35.93335,-83.87679,2023,"summer",241,236,243,239.5,241,243,242,239.5,"autumn","summer",0,0,NA,NA,NA,NA,NA,NA,1,"negative",NA,NA,0,0
"MWUT1045",130,NA,35.93321178,-83.87722396,NA,"8/29/2023 21:54","terrestrial",22,22,"raca",NA,"subadult",24,12,46.5,25.1,"y",NA,6,15,2023-08-29,"20:30:00","22:47:00","y","william_hastie_pond",35.93335,-83.87679,2023,"summer",241,236,243,239.5,241,243,242,239.5,"autumn","summer",0,0,NA,NA,NA,NA,NA,NA,1,"negative",NA,NA,0,0
"MWUT1046",130,NA,35.93330858,-83.87709551,NA,"8/29/2023 21:57","bank",22,22,"raca","female","adult",200,29,106.7,54.3,"y",NA,6,15,2023-08-29,"20:30:00","22:47:00","y","william_hastie_pond",35.93335,-83.87679,2023,"summer",241,236,243,239.5,241,243,242,239.5,"autumn","summer",0,0,NA,NA,NA,NA,NA,NA,1,"negative",NA,NA,0,0
"MWUT1047",130,NA,35.93339501,-83.87666973,NA,"8/29/2023 22:06","water;mostly submerged",22,23,"raca",NA,"subadult",29,13,52.4,28.1,"y",NA,6,15,2023-08-29,"20:30:00","22:47:00","y","william_hastie_pond",35.93335,-83.87679,2023,"summer",241,236,243,239.5,241,243,242,239.5,"autumn","summer",29.799,29.62,29.71,424.8657837,NA,NA,NA,NA,1,"positive",29.7095,424.068695338181,424.068695338181,1
"MWUT1048",132,NA,35.91586806,-84.40227941,NA,"9/7/2023 20:27","terrestrial",21,24,"gaca",NA,"subadult",10,10,14.2,4.9,"y",NA,7,1,2023-09-07,"20:00:00","23:30:00","n","ornl_powerhouse",35.914888,-84.4000154,2023,"autumn",250,250,250,250,NA,NA,NA,250,"autumn","autumn",0,0,NA,NA,NA,NA,NA,NA,1,"negative",NA,NA,0,0
"MWUT1049",132,NA,35.91546083,-84.40302934,NA,"9/7/2023 20:42","terrestrial",24,23,"gaca",NA,"subadult",10,9,14.9,5.7,"y",NA,7,1,2023-09-07,"20:00:00","23:30:00","n","ornl_powerhouse",35.914888,-84.4000154,2023,"autumn",250,250,250,250,NA,NA,NA,250,"autumn","autumn",0,0,NA,NA,NA,NA,NA,NA,1,"negative",NA,NA,0,0
"MWUT105",26,NA,35.957837,-83.869274,NA,NA,"water;submerged",21,21,"novi",NA,"adult",55,50.5,33,NA,"y",NA,0,10,2022-05-30,"21:48:00","23:04:00","n","ijams_complex_pond3",35.957797,-83.869251,2022,"spring",150,83,269,176,NA,NA,NA,150,"summer","summer",38.224,0,38.224,1.155414701,0,38.627,38.627,0.873401403,2,"positive",38.4255,1.00437931945143,1.00437931945143,1
"MWUT1050",132,NA,35.91547109,-84.40284682,NA,"9/7/2023 20:42","terrestrial",24,23,"gaca",NA,"subadult",10,9,12.5,3.6,"y",NA,7,1,2023-09-07,"20:00:00","23:30:00","n","ornl_powerhouse",35.914888,-84.4000154,2023,"autumn",250,250,250,250,NA,NA,NA,250,"autumn","autumn",0,0,NA,NA,NA,NA,NA,NA,1,"negative",NA,NA,0,0
"MWUT1051",132,NA,35.91542822,-84.40286899,NA,"9/7/2023 20:48","terrestrial",22,23,"rasp","male","adult",41,19.5,57.8,47.1,"y",NA,7,1,2023-09-07,"20:00:00","23:30:00","n","ornl_powerhouse",35.914888,-84.4000154,2023,"autumn",250,250,250,250,NA,NA,NA,250,"autumn","autumn",0,0,NA,NA,NA,NA,NA,NA,1,"negative",NA,NA,0,0
"MWUT1052",132,NA,35.9153206,-84.40297762,NA,"9/7/2023 21:00","water;mostly submerged",24,23,"racl","male","adult",58,40,57,28.3,"y",NA,7,1,2023-09-07,"20:00:00","23:30:00","n","ornl_powerhouse",35.914888,-84.4000154,2023,"autumn",250,250,250,250,NA,NA,NA,250,"autumn","autumn",0,0,NA,NA,NA,NA,NA,NA,1,"negative",NA,NA,0,0
"MWUT1053",132,NA,35.91555454,-84.40331181,NA,"9/7/2023 21:28","terrestrial",21,22,"rasp","male","adult",35,10,56.5,34.5,"y",NA,7,1,2023-09-07,"20:00:00","23:30:00","n","ornl_powerhouse",35.914888,-84.4000154,2023,"autumn",250,250,250,250,NA,NA,NA,250,"autumn","autumn",0,0,NA,NA,NA,NA,NA,NA,1,"negative",NA,NA,0,0
"MWUT1054",132,NA,35.91578195,-84.40183775,NA,"9/7/2023 20:19","terrestrial",22,23,"rasp","female","adult",70,12,75.3,58.1,"y",NA,7,1,2023-09-07,"20:00:00","23:30:00","n","ornl_powerhouse",35.914888,-84.4000154,2023,"autumn",250,250,250,250,NA,NA,NA,250,"autumn","autumn",0,0,NA,NA,NA,NA,NA,NA,1,"negative",NA,NA,0,0
"MWUT1055",132,NA,35.91584125,-84.40235783,NA,"9/7/2023 20:26","terrestrial",22,22,"rasp","female","adult",70,11,80.2,48.5,"y",NA,7,1,2023-09-07,"20:00:00","23:30:00","n","ornl_powerhouse",35.914888,-84.4000154,2023,"autumn",250,250,250,250,NA,NA,NA,250,"autumn","autumn",0,0,NA,NA,NA,NA,NA,NA,1,"negative",NA,NA,0,0
"MWUT1056",132,NA,35.91556291,-84.40308445,NA,"9/7/2023 21:43","edge;mostly submerged",22,22,"racl",NA,"subadult",69,66,38.4,14,"y",NA,7,1,2023-09-07,"20:00:00","23:30:00","n","ornl_powerhouse",35.914888,-84.4000154,2023,"autumn",250,250,250,250,NA,NA,NA,250,"autumn","autumn",0,0,NA,NA,NA,NA,NA,NA,1,"negative",NA,NA,0,0
"MWUT1057",132,NA,35.91571587,-84.40303353,NA,"9/7/2023 21:53","edge;slightly submerged",23,22,"raca","male","adult",135,11,98.7,54.9,"y",NA,7,1,2023-09-07,"20:00:00","23:30:00","n","ornl_powerhouse",35.914888,-84.4000154,2023,"autumn",250,250,250,250,NA,NA,NA,250,"autumn","autumn",0,0,NA,NA,NA,NA,NA,NA,1,"negative",NA,NA,0,0
"MWUT1058",132,NA,35.91557482,-84.40303872,NA,"9/7/2023 21:21","edge;not submerged",20,23,"racl","female","adult",98,72,65.2,33.4,"y",NA,7,1,2023-09-07,"20:00:00","23:30:00","n","ornl_powerhouse",35.914888,-84.4000154,2023,"autumn",250,250,250,250,NA,NA,NA,250,"autumn","autumn",0,0,NA,NA,NA,NA,NA,NA,1,"negative",NA,NA,0,0
"MWUT1059",132,NA,35.91603263,-84.40308433,NA,"9/7/2023 22:13","terrestrial",20,21,"racl","female","adult",30,10,59.3,30.4,"partial",NA,7,1,2023-09-07,"20:00:00","23:30:00","n","ornl_powerhouse",35.914888,-84.4000154,2023,"autumn",250,250,250,250,NA,NA,NA,250,"autumn","autumn",0,0,NA,NA,NA,NA,NA,NA,1,"negative",NA,NA,0,0
"MWUT106",26,NA,35.957797,-83.869251,NA,NA,"edge;mostly submerged",20,19,"racl","female","subadult",29.5,11,51,22.5,"y",NA,0,10,2022-05-30,"21:48:00","23:04:00","n","ijams_complex_pond3",35.957797,-83.869251,2022,"spring",150,83,269,176,NA,NA,NA,150,"summer","summer",0,0,NA,NA,NA,NA,NA,NA,1,"negative",NA,NA,0,0
"MWUT1060",132,NA,35.91601562,-84.4026414,NA,"9/7/2023 21:58","terrestrial",20,21,"rasp","female","adult",56,10,72.6,46,"y",NA,7,1,2023-09-07,"20:00:00","23:30:00","n","ornl_powerhouse",35.914888,-84.4000154,2023,"autumn",250,250,250,250,NA,NA,NA,250,"autumn","autumn",33.882,32.562,33.222,41.0627327,NA,NA,NA,NA,1,"positive",33.222,37.0986987619154,37.0986987619154,1
"MWUT1061",132,NA,35.91590401,-84.4021315,NA,"9/7/2023 22:02","terrestrial",21,22,"rasp",NA,"adult",27,10,53,33.2,"y",NA,7,1,2023-09-07,"20:00:00","23:30:00","n","ornl_powerhouse",35.914888,-84.4000154,2023,"autumn",250,250,250,250,NA,NA,NA,250,"autumn","autumn",0,0,NA,NA,NA,NA,NA,NA,1,"negative",NA,NA,0,0
"MWUT1062",132,NA,35.91604006,-84.40284462,NA,"9/7/2023 21:56","terrestrial",20,20,"racl","female","adult",34,10,60.7,31.4,"y",NA,7,1,2023-09-07,"20:00:00","23:30:00","n","ornl_powerhouse",35.914888,-84.4000154,2023,"autumn",250,250,250,250,NA,NA,NA,250,"autumn","autumn",0,39.59,39.59,0.447915405,0,0,NA,NA,2,"negative",39.59,0.447829864821388,0,0
"MWUT1064",134,NA,35.93562308,-83.93989125,NA,"9/14/2023 20:31","terrestrial",19.4,19.7,"racl","male","adult",45.5,9.5,73.8,48.7,"y",NA,7,2,2023-09-14,"19:45:00","22:54:00","y","cherokee_woodlot_wetlands",35.935746,-83.939972,2023,"autumn",257,255,257,256,255,257,256,256,"autumn","autumn",0,0,NA,NA,NA,NA,NA,NA,1,"negative",NA,NA,0,0
"MWUT1065",134,NA,35.93564667,-83.93987985,NA,"9/14/2023 20:34","bank",18.9,19.4,"racl","male","adult",40,9,66.9,37.4,"y",NA,7,2,2023-09-14,"19:45:00","22:54:00","y","cherokee_woodlot_wetlands",35.935746,-83.939972,2023,"autumn",257,255,257,256,255,257,256,256,"autumn","autumn",0,0,NA,NA,NA,NA,NA,NA,1,"negative",NA,NA,0,0
"MWUT1066",134,NA,35.93567118,-83.93982934,NA,"9/14/2023 20:37","bank",18.9,19.1,"racl","female","adult",34,10,65,36.1,"y",NA,7,2,2023-09-14,"19:45:00","22:54:00","y","cherokee_woodlot_wetlands",35.935746,-83.939972,2023,"autumn",257,255,257,256,255,257,256,256,"autumn","autumn",0,0,NA,NA,NA,NA,NA,NA,1,"negative",NA,NA,0,0
"MWUT1067",134,NA,35.93562652,-83.93978605,NA,"9/14/2023 20:43","terrestrial",18.9,19.1,"racl","male","adult",55,10,79.2,46.4,"y",NA,7,2,2023-09-14,"19:45:00","22:54:00","y","cherokee_woodlot_wetlands",35.935746,-83.939972,2023,"autumn",257,255,257,256,255,257,256,256,"autumn","autumn",38.734,38.322,38.528,0.944864869,NA,NA,NA,NA,1,"positive",38.528,0.93545193537152,0.93545193537152,1
"MWUT1068",134,NA,35.93566415,-83.93981338,NA,"9/14/2023 20:48","bank",18.8,18.7,"racl","female","adult",73,25,76.6,41.5,"y",NA,7,2,2023-09-14,"19:45:00","22:54:00","y","cherokee_woodlot_wetlands",35.935746,-83.939972,2023,"autumn",257,255,257,256,255,257,256,256,"autumn","autumn",33.133,33.086,33.109,40.11499023,NA,NA,NA,NA,1,"positive",33.1095,40.1095030686088,40.1095030686088,1
"MWUT1069",134,NA,35.93565863,-83.93982781,NA,"9/14/2023 20:52","water;mostly submerged",19.8,19.8,"racl","male","adult",230,25,116.5,62.8,"y",NA,7,2,2023-09-14,"19:45:00","22:54:00","y","cherokee_woodlot_wetlands",35.935746,-83.939972,2023,"autumn",257,255,257,256,255,257,256,256,"autumn","autumn",37.482,38.216,37.849,1.547357082,NA,NA,NA,NA,1,"positive",37.849,1.49815943036927,1.49815943036927,1
"MWUT107",26,NA,35.957797,-83.869251,NA,NA,"water;submerged",20,21,"novi",NA,"adult",57,54,30,NA,"y",NA,0,10,2022-05-30,"21:48:00","23:04:00","n","ijams_complex_pond3",35.957797,-83.869251,2022,"spring",150,83,269,176,NA,NA,NA,150,"summer","summer",0,0,NA,NA,NA,NA,NA,NA,1,"negative",NA,NA,0,0
"MWUT1070",134,NA,35.93563414,-83.93982956,NA,"9/14/2023 20:58","bank",18.8,18.8,"raca","female","adult",60.5,19.5,73.4,41.4,"y",NA,7,2,2023-09-14,"19:45:00","22:54:00","y","cherokee_woodlot_wetlands",35.935746,-83.939972,2023,"autumn",257,255,257,256,255,257,256,256,"autumn","autumn",33.037,32.957,32.997,43.3757782,NA,NA,NA,NA,1,"positive",32.997,43.3646540202177,43.3646540202177,1
"MWUT1071",134,NA,35.93568642,-83.93999745,NA,"9/14/2023 20:38","water;mostly submerged",21,22,"raca",NA,"subadult",28,13.5,52.3,26.8,"y",NA,7,2,2023-09-14,"19:45:00","22:54:00","y","cherokee_woodlot_wetlands",35.935746,-83.939972,2023,"autumn",257,255,257,256,255,257,256,256,"autumn","autumn",0,0,NA,NA,NA,NA,NA,NA,1,"negative",NA,NA,0,0
"MWUT1072",134,NA,35.93569944,-83.93996644,NA,"9/14/2023 20:39","edge;mostly submerged",21,21,"racl","male","adult",60,22,72.5,38.4,"y",NA,7,2,2023-09-14,"19:45:00","22:54:00","y","cherokee_woodlot_wetlands",35.935746,-83.939972,2023,"autumn",257,255,257,256,255,257,256,256,"autumn","autumn",38.238,37.583,37.911,1.472699642,NA,NA,NA,NA,1,"positive",37.9105,1.43559607392229,1.43559607392229,1
"MWUT1073",134,NA,35.93570325,-83.93992684,NA,"9/14/2023 20:39","edge;mostly submerged",21,22,"racl","female","adult",71.5,29.5,75.6,40.4,"y",NA,7,2,2023-09-14,"19:45:00","22:54:00","y","cherokee_woodlot_wetlands",35.935746,-83.939972,2023,"autumn",257,255,257,256,255,257,256,256,"autumn","autumn",32.788,33.022,32.905,46.37771606,NA,NA,NA,NA,1,"positive",32.905,46.2220532295814,46.2220532295814,1
"MWUT1074",134,NA,35.93567084,-83.94001165,NA,"9/14/2023 20:45","bank",20,21,"racl","female","adult",74,31,78.6,39.3,"y",NA,7,2,2023-09-14,"19:45:00","22:54:00","y","cherokee_woodlot_wetlands",35.935746,-83.939972,2023,"autumn",257,255,257,256,255,257,256,256,"autumn","autumn",0,0,NA,NA,NA,NA,NA,NA,1,"negative",NA,NA,0,0
"MWUT1075",134,NA,35.93569414,-83.93998581,NA,"9/14/2023 20:53","edge;mostly submerged",21,21,"racl","male","adult",56,18,76.7,40.3,"y",NA,7,2,2023-09-14,"19:45:00","22:54:00","y","cherokee_woodlot_wetlands",35.935746,-83.939972,2023,"autumn",257,255,257,256,255,257,256,256,"autumn","autumn",0,0,NA,NA,NA,NA,NA,NA,1,"negative",NA,NA,0,0
"MWUT1076",134,NA,35.93559355,-83.93995935,NA,"9/14/2023 21:02","edge;mostly submerged",21,21,"raca",NA,"subadult",33,15,55.8,30.3,"y",NA,7,2,2023-09-14,"19:45:00","22:54:00","y","cherokee_woodlot_wetlands",35.935746,-83.939972,2023,"autumn",257,255,257,256,255,257,256,256,"autumn","autumn",31.994,32.096,32.045,83.98574829,NA,NA,NA,NA,1,"positive",32.045,83.9283696747699,83.9283696747699,1
"MWUT1077",140,NA,35.95682478,-83.86815748,NA,"9/20/2023 20:57","edge;not submerged",20,22,"racl","male","adult",40,10,65.6,34.6,"y",NA,7,7,2023-09-20,"20:04:00","23:41:00","y","ijams_lotus_pond",35.956677,-83.868347,2023,"autumn",263,262,263,262.5,262,263,262.5,262.5,"autumn","autumn",0,0,NA,NA,NA,NA,NA,NA,1,"negative",NA,NA,0,0
"MWUT1078",140,NA,35.95668013,-83.86820772,NA,"9/20/2023 20:37","water;fully submerged",18.8,19.8,"novi","male","adult",34,28.5,49.4,NA,"y",NA,7,7,2023-09-20,"20:04:00","23:41:00","y","ijams_lotus_pond",35.956677,-83.868347,2023,"autumn",263,262,263,262.5,262,263,262.5,262.5,"autumn","autumn",0,0,NA,NA,NA,NA,NA,NA,1,"negative",NA,NA,0,0
"MWUT1079",140,NA,35.95676217,-83.8682949,NA,"9/20/2023 21:01","edge;not submerged",20,21,"racl","male","adult",69,39,68.4,36.1,"y",NA,7,7,2023-09-20,"20:04:00","23:41:00","y","ijams_lotus_pond",35.956677,-83.868347,2023,"autumn",263,262,263,262.5,262,263,262.5,262.5,"autumn","autumn",0,0,NA,NA,NA,NA,NA,NA,1,"negative",NA,NA,0,0
"MWUT108",26,NA,35.957797,-83.869251,NA,NA,"water;submerged",21,21,"novi",NA,"adult",74,72.5,37.5,NA,"y",NA,0,10,2022-05-30,"21:48:00","23:04:00","n","ijams_complex_pond3",35.957797,-83.869251,2022,"spring",150,83,269,176,NA,NA,NA,150,"summer","summer",0,0,NA,NA,NA,NA,NA,NA,1,"negative",NA,NA,0,0
"MWUT1080",140,NA,35.95682791,-83.86830814,NA,"9/20/2023 21:05","edge;not submerged",20,21,"racl","male","adult",80,31.5,76.2,39.9,"y",NA,7,7,2023-09-20,"20:04:00","23:41:00","y","ijams_lotus_pond",35.956677,-83.868347,2023,"autumn",263,262,263,262.5,262,263,262.5,262.5,"autumn","autumn",0,0,NA,NA,NA,NA,NA,NA,1,"negative",NA,NA,0,0
"MWUT1081",140,NA,35.9567133,-83.86818279,NA,"9/20/2023 20:41","water;fully submerged",19,20,"novi","male","adult",28.5,23,51.3,NA,"y",NA,7,7,2023-09-20,"20:04:00","23:41:00","y","ijams_lotus_pond",35.956677,-83.868347,2023,"autumn",263,262,263,262.5,262,263,262.5,262.5,"autumn","autumn",0,0,NA,NA,NA,NA,NA,NA,1,"negative",NA,NA,0,0
"MWUT1082",140,NA,35.95681994,-83.86831843,NA,"9/20/2023 21:07","edge;not submerged",20,22,"racl","male","adult",37,9,64.1,31.8,"y",NA,7,7,2023-09-20,"20:04:00","23:41:00","y","ijams_lotus_pond",35.956677,-83.868347,2023,"autumn",263,262,263,262.5,262,263,262.5,262.5,"autumn","autumn",0,0,NA,NA,NA,NA,NA,NA,1,"negative",NA,NA,0,0
"MWUT1083",140,NA,35.95681814,-83.8683652,NA,"9/20/2023 21:15","water;mostly submerged",20,21,"racl","female","adult",77,29,77.4,39.2,"y",NA,7,7,2023-09-20,"20:04:00","23:41:00","y","ijams_lotus_pond",35.956677,-83.868347,2023,"autumn",263,262,263,262.5,262,263,262.5,262.5,"autumn","autumn",0,0,NA,NA,NA,NA,NA,NA,1,"negative",NA,NA,0,0
"MWUT1084",140,NA,35.95666777,-83.8681779,NA,"9/20/2023 21:33","edge;slightly submerged",19.2,20,"racl","male","adult",70.5,15,75.9,37.9,"y",NA,7,7,2023-09-20,"20:04:00","23:41:00","y","ijams_lotus_pond",35.956677,-83.868347,2023,"autumn",263,262,263,262.5,262,263,262.5,262.5,"autumn","autumn",0,0,NA,NA,NA,NA,NA,NA,1,"negative",NA,NA,0,0
"MWUT1085",140,NA,35.95679376,-83.86818527,NA,"9/20/2023 21:22","edge;not submerged",20,21,"racl","male","adult",40,9,69.1,35.8,"y",NA,7,7,2023-09-20,"20:04:00","23:41:00","y","ijams_lotus_pond",35.956677,-83.868347,2023,"autumn",263,262,263,262.5,262,263,262.5,262.5,"autumn","autumn",0,0,NA,NA,NA,NA,NA,NA,1,"negative",NA,NA,0,0
"MWUT1086",140,NA,35.95683011,-83.86819059,NA,"9/20/2023 21:39","water;fully submerged",18.5,19.3,"novi","female","adult",47,41,53.6,NA,"y",NA,7,7,2023-09-20,"20:04:00","23:41:00","y","ijams_lotus_pond",35.956677,-83.868347,2023,"autumn",263,262,263,262.5,262,263,262.5,262.5,"autumn","autumn",0,0,NA,NA,NA,NA,NA,NA,1,"negative",NA,NA,0,0
"MWUT1087",140,NA,35.95667086,-83.86834354,NA,"9/20/2023 21:38","edge;mostly submerged",19,19,"raca",NA,"subadult",66,48.5,52.1,27.4,"y",NA,7,7,2023-09-20,"20:04:00","23:41:00","y","ijams_lotus_pond",35.956677,-83.868347,2023,"autumn",263,262,263,262.5,262,263,262.5,262.5,"autumn","autumn",0,0,NA,NA,NA,NA,NA,NA,1,"negative",NA,NA,0,0
"MWUT1088",140,NA,35.95675123,-83.86820128,NA,"9/20/2023 21:15","edge;fully submerged",19,19,"novi","male","adult",58,54,47.3,NA,"y",NA,7,7,2023-09-20,"20:04:00","23:41:00","y","ijams_lotus_pond",35.956677,-83.868347,2023,"autumn",263,262,263,262.5,262,263,262.5,262.5,"autumn","autumn",0,0,NA,NA,NA,NA,NA,NA,1,"negative",NA,NA,0,0
"MWUT1089",140,NA,35.95669213,-83.86817939,NA,"9/20/2023 20:46","bank",20,20,"racl","male","adult",60,28,67,35.1,"y",NA,7,7,2023-09-20,"20:04:00","23:41:00","y","ijams_lotus_pond",35.956677,-83.868347,2023,"autumn",263,262,263,262.5,262,263,262.5,262.5,"autumn","autumn",33.434,32.727,33.08,42.1641655,NA,NA,NA,NA,1,"positive",33.0805,40.9244649872765,40.9244649872765,1
"MWUT109",26,NA,35.957776,-83.86927,NA,NA,"bank",19,19,"racl",NA,"subadult",70.5,59,52.5,24,"y",NA,0,10,2022-05-30,"21:48:00","23:04:00","n","ijams_complex_pond3",35.957797,-83.869251,2022,"spring",150,83,269,176,NA,NA,NA,150,"summer","summer",0,0,NA,NA,NA,NA,NA,NA,1,"negative",NA,NA,0,0
"MWUT1090",140,NA,35.95674664,-83.86819431,NA,"9/20/2023 20:56","bank",19,20,"racl","male","adult",78.5,37,66.5,31.8,"y",NA,7,7,2023-09-20,"20:04:00","23:41:00","y","ijams_lotus_pond",35.956677,-83.868347,2023,"autumn",263,262,263,262.5,262,263,262.5,262.5,"autumn","autumn",32.306,33.224,32.765,53.53068542,NA,NA,NA,NA,1,"positive",32.765,50.9356343052995,50.9356343052995,1
"MWUT1091",140,NA,35.95678443,-83.86825736,NA,"9/20/2023 23:07","edge;fully submerged",19,19,"novi","male","adult",72,67,48.7,NA,"y",NA,7,7,2023-09-20,"20:04:00","23:41:00","y","ijams_lotus_pond",35.956677,-83.868347,2023,"autumn",263,262,263,262.5,262,263,262.5,262.5,"autumn","autumn",0,0,NA,NA,NA,NA,NA,NA,1,"negative",NA,NA,0,0
"MWUT1092",140,NA,35.95677465,-83.86817145,NA,"9/20/2023 21:20","edge;fully submerged",19,19,"novi","male","adult",37.5,34,50.6,NA,"y",NA,7,7,2023-09-20,"20:04:00","23:41:00","y","ijams_lotus_pond",35.956677,-83.868347,2023,"autumn",263,262,263,262.5,262,263,262.5,262.5,"autumn","autumn",0,0,NA,NA,NA,NA,NA,NA,1,"negative",NA,NA,0,0
"MWUT1093",140,NA,35.95683894,-83.86819761,NA,"9/20/2023 20:53","bank",20,21,"racl","male","adult",62.5,25,73.8,34.2,"y",NA,7,7,2023-09-20,"20:04:00","23:41:00","y","ijams_lotus_pond",35.956677,-83.868347,2023,"autumn",263,262,263,262.5,262,263,262.5,262.5,"autumn","autumn",38.087,37.214,37.65,1.798882008,NA,NA,NA,NA,1,"positive",37.6505,1.71930367746148,1.71930367746148,1
"MWUT1094",140,NA,35.95679673,-83.86818139,NA,"9/20/2023 23:10","edge;fully submerged",19,19,"novi","male","adult",41,36.5,49.9,NA,"y",NA,7,7,2023-09-20,"20:04:00","23:41:00","y","ijams_lotus_pond",35.956677,-83.868347,2023,"autumn",263,262,263,262.5,262,263,262.5,262.5,"autumn","autumn",0,0,NA,NA,NA,NA,NA,NA,1,"negative",NA,NA,0,0
"MWUT1095",140,NA,35.95673724,-83.86818295,NA,"9/20/2023 21:21","edge;fully submerged",19,20,"novi","male","adult",45,39.5,47.9,NA,"y",NA,7,7,2023-09-20,"20:04:00","23:41:00","y","ijams_lotus_pond",35.956677,-83.868347,2023,"autumn",263,262,263,262.5,262,263,262.5,262.5,"autumn","autumn",0,0,NA,NA,NA,NA,NA,NA,1,"negative",NA,NA,0,0
"MWUT1096",140,NA,35.95675178,-83.86823077,NA,"9/20/2023 23:22","edge;fully submerged",19,19,"novi","male","adult",32.5,28,47.3,NA,"y",NA,7,7,2023-09-20,"20:04:00","23:41:00","y","ijams_lotus_pond",35.956677,-83.868347,2023,"autumn",263,262,263,262.5,262,263,262.5,262.5,"autumn","autumn",33.576,33.751,33.664,27.36024475,NA,NA,NA,NA,1,"positive",33.6635,27.3127061167642,27.3127061167642,1
"MWUT1097",140,NA,NA,NA,NA,"9/20/2023 21:21","edge;fully submerged",19,19,"novi","female","adult",45,40.5,42,NA,"y",NA,7,7,2023-09-20,"20:04:00","23:41:00","y","ijams_lotus_pond",35.956677,-83.868347,2023,"autumn",263,262,263,262.5,262,263,262.5,262.5,"autumn","autumn",31.806,30.954,31.38,138.9301605,NA,NA,NA,NA,1,"positive",31.38,133.115336057132,133.115336057132,1
"MWUT1098",145,NA,35.95787372,-83.86917997,NA,"9/26/2023 20:45","water;fully submerged",22,23,"novi","male","adult",60,60,39,NA,"y",NA,7,10,2023-09-26,"20:02:00","23:13:00","n","ijams_complex_pond3",35.957797,-83.869251,2023,"autumn",269,262,269,265.5,262,263,262.5,265.5,"autumn","autumn",28.619,28.495,28.557,944.0552979,NA,NA,NA,NA,1,"positive",28.557,943.205097271901,943.205097271901,1
"MWUT1099",145,NA,35.95780998,-83.86931056,NA,"9/26/2023 20:40","bank",23,22,"racl","female","adult",40,10,60,34,"y",NA,7,10,2023-09-26,"20:02:00","23:13:00","n","ijams_complex_pond3",35.957797,-83.869251,2023,"autumn",269,262,269,265.5,262,263,262.5,265.5,"autumn","autumn",0,0,NA,NA,NA,NA,NA,NA,1,"negative",NA,NA,0,0
"MWUT110",26,NA,35.957776,-83.86927,NA,NA,"water;submerged",20,20,"novi",NA,"adult",43,42.5,29.5,NA,"y",NA,0,10,2022-05-30,"21:48:00","23:04:00","n","ijams_complex_pond3",35.957797,-83.869251,2022,"spring",150,83,269,176,NA,NA,NA,150,"summer","summer",0,0,NA,NA,NA,NA,NA,NA,1,"negative",NA,NA,0,0
"MWUT1100",145,NA,35.95781764,-83.86931743,NA,"9/26/2023 20:37","terrestrial",21,20,"racl","female","adult",30,10,52,23,"y",NA,7,10,2023-09-26,"20:02:00","23:13:00","n","ijams_complex_pond3",35.957797,-83.869251,2023,"autumn",269,262,269,265.5,262,263,262.5,265.5,"autumn","autumn",0,0,NA,NA,NA,NA,NA,NA,1,"negative",NA,NA,0,0
"MWUT1101",145,NA,35.95777201,-83.86926253,NA,"9/26/2023 20:33","terrestrial",23.1,20.6,"racl","female","adult",30,10,51.5,30,"y",NA,7,10,2023-09-26,"20:02:00","23:13:00","n","ijams_complex_pond3",35.957797,-83.869251,2023,"autumn",269,262,269,265.5,262,263,262.5,265.5,"autumn","autumn",0,0,NA,NA,NA,NA,NA,NA,1,"negative",NA,NA,0,0
"MWUT1102",145,NA,35.95779832,-83.8691886,NA,"9/26/2023 20:35","terrestrial",22,23,"racl","female","adult",35,10,51,27,"y",NA,7,10,2023-09-26,"20:02:00","23:13:00","n","ijams_complex_pond3",35.957797,-83.869251,2023,"autumn",269,262,269,265.5,262,263,262.5,265.5,"autumn","autumn",36.794,38.696,37.745,1.973846436,NA,NA,NA,NA,1,"positive",37.745,1.61022351430725,1.61022351430725,1
"MWUT1103",150,NA,35.9575755,-83.86840747,NA,"9/26/2023 20:20","bank",23,23,"racl",NA,"subadult",30,10,47,24,"y",NA,7,9,2023-09-26,"20:02:00","23:13:00","n","ijams_complex_pond2",35.957569,-83.868485,2023,"autumn",269,262,269,265.5,262,263,262.5,265.5,"autumn","autumn",37.004,37.519,37.262,2.287638664,NA,NA,NA,NA,1,"positive",37.2615,2.25181057989343,2.25181057989343,1
"MWUT1104",150,NA,35.95754998,-83.86842271,NA,"9/26/2023 20:20","edge;not submerged",22,22,"racl",NA,"subadult",25,10,40,21,"y",NA,7,9,2023-09-26,"20:02:00","23:13:00","n","ijams_complex_pond2",35.957569,-83.868485,2023,"autumn",269,262,269,265.5,262,263,262.5,265.5,"autumn","autumn",31.164,32.163,31.663,115.9813843,NA,NA,NA,NA,1,"positive",31.6635,109.352523560706,109.352523560706,1
"MWUT1105",146,NA,35.95800557,-83.86891695,NA,"9/26/2023 20:28","bank",22,23,"racl","female","adult",35,10,52,28,"y",NA,7,11,2023-09-26,"20:02:00","23:13:00","n","ijams_complex_pond4",35.958002,-83.868892,2023,"autumn",269,262,269,265.5,262,263,262.5,265.5,"autumn","autumn",0,0,NA,NA,NA,NA,NA,NA,1,"negative",NA,NA,0,0
"MWUT1106",145,NA,35.95777033,-83.86923378,NA,"9/26/2023 20:40","edge;mostly submerged",24,24,"racl","female","adult",65,30,71.5,38.5,"y",NA,7,10,2023-09-26,"20:02:00","23:13:00","n","ijams_complex_pond3",35.957797,-83.869251,2023,"autumn",269,262,269,265.5,262,263,262.5,265.5,"autumn","autumn",0,0,NA,NA,NA,NA,NA,NA,1,"negative",NA,NA,0,0
"MWUT1107",145,NA,35.9578267,-83.86931357,NA,"9/26/2023 20:51","edge;not submerged",23,23,"racl","male","adult",60,40,54,31,"y",NA,7,10,2023-09-26,"20:02:00","23:13:00","n","ijams_complex_pond3",35.957797,-83.869251,2023,"autumn",269,262,269,265.5,262,263,262.5,265.5,"autumn","autumn",38.8,37.374,38.087,1.428436995,NA,NA,NA,NA,1,"positive",38.087,1.27017864562581,1.27017864562581,1
"MWUT1108",145,NA,35.95779749,-83.86923999,NA,"9/26/2023 21:21","bank",22,23,"racl","female","adult",40,10,58,32,"y",NA,7,10,2023-09-26,"20:02:00","23:13:00","n","ijams_complex_pond3",35.957797,-83.869251,2023,"autumn",269,262,269,265.5,262,263,262.5,265.5,"autumn","autumn",0,0,NA,NA,NA,NA,NA,NA,1,"negative",NA,NA,0,0
"MWUT1109",145,NA,35.95781081,-83.86929832,NA,"9/26/2023 20:50","edge;fully submerged",23,23,"novi","male","adult",110,105,44,NA,"y",NA,7,10,2023-09-26,"20:02:00","23:13:00","n","ijams_complex_pond3",35.957797,-83.869251,2023,"autumn",269,262,269,265.5,262,263,262.5,265.5,"autumn","autumn",37.569,36.743,37.156,2.523361444,NA,NA,NA,NA,1,"positive",37.156,2.42276803655994,2.42276803655994,1
"MWUT111",26,NA,35.957767,-83.869252,NA,NA,"bank",19,20,"racl",NA,"subadult",47,38.5,31.5,15,"y",NA,0,10,2022-05-30,"21:48:00","23:04:00","n","ijams_complex_pond3",35.957797,-83.869251,2022,"spring",150,83,269,176,NA,NA,NA,150,"summer","summer",29.248,29.077,29.162,620.8909912,NA,NA,NA,NA,1,"positive",29.1625,619.740872845436,619.740872845436,1
"MWUT1110",145,NA,35.9578077,-83.86928893,NA,"9/26/2023 21:23","edge;fully submerged",23,23,"novi","male","adult",155,150,43,NA,"y",NA,7,10,2023-09-26,"20:02:00","23:13:00","n","ijams_complex_pond3",35.957797,-83.869251,2023,"autumn",269,262,269,265.5,262,263,262.5,265.5,"autumn","autumn",39.094,0,39.094,0.631652057,0,0,NA,NA,2,"negative",39.094,0.631719297503772,0,0
"MWUT1111",145,NA,35.95779571,-83.86921265,NA,"9/26/2023 21:26","bank",23,23,"racl","male","adult",45,10,59,33,"y",NA,7,10,2023-09-26,"20:02:00","23:13:00","n","ijams_complex_pond3",35.957797,-83.869251,2023,"autumn",269,262,269,265.5,262,263,262.5,265.5,"autumn","autumn",0,0,NA,NA,NA,NA,NA,NA,1,"negative",NA,NA,0,0
"MWUT1112",145,NA,NA,NA,NA,NA,NA,NA,NA,"racl","female","adult",35,10,51,31,"y",NA,7,10,2023-09-26,"20:02:00","23:13:00","n","ijams_complex_pond3",35.957797,-83.869251,2023,"autumn",269,262,269,265.5,262,263,262.5,265.5,"autumn","autumn",34.752,34.245,34.499,15.5418129,NA,NA,NA,NA,1,"positive",34.4985,15.3050932207024,15.3050932207024,1
"MWUT1113",145,NA,35.95779058,-83.86925497,NA,"9/26/2023 21:28","water;fully submerged",23,23,"novi","female","adult",220,215,31,NA,"y",NA,7,10,2023-09-26,"20:02:00","23:13:00","n","ijams_complex_pond3",35.957797,-83.869251,2023,"autumn",269,262,269,265.5,262,263,262.5,265.5,"autumn","autumn",36.531,36.485,36.508,3.797484398,NA,NA,NA,NA,1,"positive",36.508,3.7976085518817,3.7976085518817,1
"MWUT1114",145,NA,35.95782771,-83.86926652,NA,"9/26/2023 21:24","edge;mostly submerged",23,23,"racl","male","adult",110,95,50,29,"y",NA,7,10,2023-09-26,"20:02:00","23:13:00","n","ijams_complex_pond3",35.957797,-83.869251,2023,"autumn",269,262,269,265.5,262,263,262.5,265.5,"autumn","autumn",34.065,34.092,34.079,20.47833633,NA,NA,NA,NA,1,"positive",34.0785,20.4811074281025,20.4811074281025,1
"MWUT1115",145,NA,35.95778124,-83.86921301,NA,"9/26/2023 22:11","edge;fully submerged",22,21,"novi","male","adult",95,90,50,NA,"y",NA,7,10,2023-09-26,"20:02:00","23:13:00","n","ijams_complex_pond3",35.957797,-83.869251,2023,"autumn",269,262,269,265.5,262,263,262.5,265.5,"autumn","autumn",38.852,0,38.852,0.746949434,0,0,NA,NA,2,"negative",38.852,0.747174939694279,0,0
"MWUT1116",145,NA,35.95779376,-83.869256,NA,"9/26/2023 22:10","edge;fully submerged",22,22,"novi","female","adult",140,135,46,NA,"y",NA,7,10,2023-09-26,"20:02:00","23:13:00","n","ijams_complex_pond3",35.957797,-83.869251,2023,"autumn",269,262,269,265.5,262,263,262.5,265.5,"autumn","autumn",37.034,36.867,36.95,2.798846006,NA,NA,NA,NA,1,"positive",36.9505,2.79392677349855,2.79392677349855,1
"MWUT1117",145,NA,35.95782221,-83.86927101,NA,"9/26/2023 22:10","edge;fully submerged",22,23,"novi","male","adult",115,110,47,NA,"y",NA,7,10,2023-09-26,"20:02:00","23:13:00","n","ijams_complex_pond3",35.957797,-83.869251,2023,"autumn",269,262,269,265.5,262,263,262.5,265.5,"autumn","autumn",36.408,36.937,36.672,3.445366621,NA,NA,NA,NA,1,"positive",36.6725,3.38811019021819,3.38811019021819,1
"MWUT1118",145,NA,35.95777561,-83.86926153,NA,"9/26/2023 22:14","edge;fully submerged",22,21,"novi",NA,"adult",125,120,35,NA,"y",NA,7,10,2023-09-26,"20:02:00","23:13:00","n","ijams_complex_pond3",35.957797,-83.869251,2023,"autumn",269,262,269,265.5,262,263,262.5,265.5,"autumn","autumn",0,0,NA,NA,NA,NA,NA,NA,1,"negative",NA,NA,0,0
"MWUT1119",147,NA,35.93335355,-83.8766604,NA,"9/27/2023 20:30","edge;not submerged",20.1,22.3,"raca",NA,"subadult",21,9.5,48.9,20.4,"y",NA,7,15,2023-09-27,"19:58:00",NA,"n","william_hastie_pond",35.93335,-83.87679,2023,"autumn",270,270,276,273,275,276,275.5,273,"autumn","autumn",0,0,NA,NA,NA,NA,NA,NA,1,"negative",NA,NA,0,0
"MWUT112",26,NA,35.957789,-83.869206,NA,NA,"bank;mud",19,20,"racl","male","adult",42,9.5,58,31,"y",NA,0,10,2022-05-30,"21:48:00","23:04:00","n","ijams_complex_pond3",35.957797,-83.869251,2022,"spring",150,83,269,176,NA,NA,NA,150,"summer","summer",0,0,NA,NA,NA,NA,NA,NA,1,"negative",NA,NA,0,0
"MWUT1120",147,NA,35.93340525,-83.87666482,NA,"9/27/2023 21:03","bank",21,20,"raca","female","adult",260,80,113.1,56.5,"y",NA,7,15,2023-09-27,"19:58:00",NA,"n","william_hastie_pond",35.93335,-83.87679,2023,"autumn",270,270,276,273,275,276,275.5,273,"autumn","autumn",0,0,NA,NA,NA,NA,NA,NA,1,"negative",NA,NA,0,0
"MWUT1121",147,NA,35.93327032,-83.87681796,NA,"9/27/2023 20:55","bank",19,19,"raca","female","adult",255,57.5,116.4,61.3,"y",NA,7,15,2023-09-27,"19:58:00",NA,"n","william_hastie_pond",35.93335,-83.87679,2023,"autumn",270,270,276,273,275,276,275.5,273,"autumn","autumn",0,0,NA,NA,NA,NA,NA,NA,1,"negative",NA,NA,0,0
"MWUT1122",147,NA,35.93329076,-83.87695784,NA,"9/27/2023 20:48","edge;slightly submerged",19,19,"raca",NA,"subadult",41,22,55.8,24.3,"y",NA,7,15,2023-09-27,"19:58:00",NA,"n","william_hastie_pond",35.93335,-83.87679,2023,"autumn",270,270,276,273,275,276,275.5,273,"autumn","autumn",32.735,32.082,32.408,66.91806793,NA,NA,NA,NA,1,"positive",32.4085,65.2245273623211,65.2245273623211,1
"MWUT1123",147,NA,35.9333251,-83.87687497,NA,"9/27/2023 20:54","bank",19,19,"raca","male","adult",200,29,111.6,56.6,"y",NA,7,15,2023-09-27,"19:58:00",NA,"n","william_hastie_pond",35.93335,-83.87679,2023,"autumn",270,270,276,273,275,276,275.5,273,"autumn","autumn",0,0,NA,NA,NA,NA,NA,NA,1,"negative",NA,NA,0,0
"MWUT1124",147,NA,35.93330183,-83.87695759,NA,"9/27/2023 20:46","bank",20,20,"raca","female","adult",140,22,107.7,42.5,"y",NA,7,15,2023-09-27,"19:58:00",NA,"n","william_hastie_pond",35.93335,-83.87679,2023,"autumn",270,270,276,273,275,276,275.5,273,"autumn","autumn",0,0,NA,NA,NA,NA,NA,NA,1,"negative",NA,NA,0,0
"MWUT1125",147,NA,35.93330963,-83.87695955,NA,"9/27/2023 20:47","bank",20,20,"raca","male","adult",130,36,82.1,49.5,"y",NA,7,15,2023-09-27,"19:58:00",NA,"n","william_hastie_pond",35.93335,-83.87679,2023,"autumn",270,270,276,273,275,276,275.5,273,"autumn","autumn",0,0,NA,NA,NA,NA,NA,NA,1,"negative",NA,NA,0,0
"MWUT1126",147,NA,35.9332889,-83.87693472,NA,"9/27/2023 21:26","edge;mostly submerged",20,21,"raca","female","adult",118,21,105.1,42.1,"y",NA,7,15,2023-09-27,"19:58:00",NA,"n","william_hastie_pond",35.93335,-83.87679,2023,"autumn",270,270,276,273,275,276,275.5,273,"autumn","autumn",0,0,NA,NA,NA,NA,NA,NA,1,"negative",NA,NA,0,0
"MWUT1127",147,NA,35.93330942,-83.87679323,NA,"9/27/2023 21:21","water;not submerged",19.9,19.8,"raca",NA,"subadult",36,20,54.9,27,"y",NA,7,15,2023-09-27,"19:58:00",NA,"n","william_hastie_pond",35.93335,-83.87679,2023,"autumn",270,270,276,273,275,276,275.5,273,"autumn","autumn",36.347,35.516,35.932,5.900126457,NA,NA,NA,NA,1,"positive",35.9315,5.66461590224696,5.66461590224696,1
"MWUT1128",147,NA,35.9333424,-83.87687852,NA,"9/27/2023 20:45","bank",20,20,"raca","female","adult",60,21,68.5,28.4,"y",NA,7,15,2023-09-27,"19:58:00",NA,"n","william_hastie_pond",35.93335,-83.87679,2023,"autumn",270,270,276,273,275,276,275.5,273,"autumn","autumn",0,0,NA,NA,NA,NA,NA,NA,1,"negative",NA,NA,0,0
"MWUT1129",147,NA,35.93324904,-83.8767845,NA,"9/27/2023 20:18","water;mostly submerged",18.8,18.9,"raca",NA,"subadult",31,18.5,48.2,24.5,"y",NA,7,15,2023-09-27,"19:58:00",NA,"n","william_hastie_pond",35.93335,-83.87679,2023,"autumn",270,270,276,273,275,276,275.5,273,"autumn","autumn",36.543,35.626,36.084,5.355662823,NA,NA,NA,NA,1,"positive",36.0845,5.0942700712961,5.0942700712961,1
"MWUT113",26,NA,35.957776,-83.86927,NA,NA,"water;submerged",20,20,"novi",NA,"adult",56,55.5,32.5,NA,"y",NA,0,10,2022-05-30,"21:48:00","23:04:00","n","ijams_complex_pond3",35.957797,-83.869251,2022,"spring",150,83,269,176,NA,NA,NA,150,"summer","summer",36.173,35.734,35.953,5.644324303,NA,NA,NA,NA,1,"positive",35.9535,5.57883301500657,5.57883301500657,1
"MWUT1130",147,NA,35.9332914,-83.87693815,NA,"9/27/2023 20:52","bank",19,19,"raca","male","adult",170,43,90.9,48.6,"y",NA,7,15,2023-09-27,"19:58:00",NA,"n","william_hastie_pond",35.93335,-83.87679,2023,"autumn",270,270,276,273,275,276,275.5,273,"autumn","autumn",0,0,NA,NA,NA,NA,NA,NA,1,"negative",NA,NA,0,0
"MWUT1131",147,NA,35.93329298,-83.87674644,NA,"9/27/2023 20:23","water;slightly submerged",19.1,19.2,"raca",NA,"subadult",29,14.5,52.3,25.8,"y",NA,7,15,2023-09-27,"19:58:00",NA,"n","william_hastie_pond",35.93335,-83.87679,2023,"autumn",270,270,276,273,275,276,275.5,273,"autumn","autumn",37.526,35.419,36.472,4.979157448,NA,NA,NA,NA,1,"positive",36.4725,3.89227873999522,3.89227873999522,1
"MWUT1132",147,NA,35.93336558,-83.87663673,NA,"9/27/2023 20:56","edge;not submerged",18.7,19.4,"raca",NA,"subadult",49,39,46.3,23.2,"y",NA,7,15,2023-09-27,"19:58:00",NA,"n","william_hastie_pond",35.93335,-83.87679,2023,"autumn",270,270,276,273,275,276,275.5,273,"autumn","autumn",0,0,NA,NA,NA,NA,NA,NA,1,"negative",NA,NA,0,0
"MWUT1133",147,NA,35.93340765,-83.87668392,NA,"9/27/2023 20:37","bank",20,20,"racl","male","adult",46,10,72.6,40.1,"y",NA,7,15,2023-09-27,"19:58:00",NA,"n","william_hastie_pond",35.93335,-83.87679,2023,"autumn",270,270,276,273,275,276,275.5,273,"autumn","autumn",0,0,NA,NA,NA,NA,NA,NA,1,"negative",NA,NA,0,0
"MWUT1134",147,NA,35.93339658,-83.87679527,NA,"9/27/2023 20:41","water;slightly submerged",20,20,"raca",NA,"subadult",49,20,61.3,33.2,"y",NA,7,15,2023-09-27,"19:58:00",NA,"n","william_hastie_pond",35.93335,-83.87679,2023,"autumn",270,270,276,273,275,276,275.5,273,"autumn","autumn",34.153,34.086,34.119,19.91519737,NA,NA,NA,NA,1,"positive",34.1195,19.906867323627,19.906867323627,1
"MWUT1135",147,NA,35.93340683,-83.87685193,NA,"9/27/2023 20:44","terrestrial",20,20,"racl","male","adult",71.5,30.5,74.1,39.4,"y",NA,7,15,2023-09-27,"19:58:00",NA,"n","william_hastie_pond",35.93335,-83.87679,2023,"autumn",270,270,276,273,275,276,275.5,273,"autumn","autumn",0,0,NA,NA,NA,NA,NA,NA,1,"negative",NA,NA,0,0
"MWUT1136",147,NA,35.93334189,-83.87680513,NA,"9/27/2023 20:39","water;mostly submerged",20,20,"raca",NA,"subadult",55.5,40,56.4,25.3,"y",NA,7,15,2023-09-27,"19:58:00",NA,"n","william_hastie_pond",35.93335,-83.87679,2023,"autumn",270,270,276,273,275,276,275.5,273,"autumn","autumn",31.117,30.975,31.046,168.0124512,NA,NA,NA,NA,1,"positive",31.046,167.818406869719,167.818406869719,1
"MWUT1137",147,NA,35.93329653,-83.8767333,NA,"9/27/2023 21:20","terrestrial",20,21,"racl","male","adult",53,9.5,75.7,40.1,"y",NA,7,15,2023-09-27,"19:58:00",NA,"n","william_hastie_pond",35.93335,-83.87679,2023,"autumn",270,270,276,273,275,276,275.5,273,"autumn","autumn",0,0,NA,NA,NA,NA,NA,NA,1,"negative",NA,NA,0,0
"MWUT1138",147,NA,35.93342577,-83.87666906,NA,"9/27/2023 20:39","edge;not submerged",19.3,19.1,"racl","female","adult",54,22,71.9,34.4,"y",NA,7,15,2023-09-27,"19:58:00",NA,"n","william_hastie_pond",35.93335,-83.87679,2023,"autumn",270,270,276,273,275,276,275.5,273,"autumn","autumn",0,0,NA,NA,NA,NA,NA,NA,1,"negative",NA,NA,0,0
"MWUT1139",147,NA,35.93316442,-83.87687576,NA,"9/27/2023 21:19","terrestrial",20,20,"racl","female","adult",55.5,10,78.1,40.6,"y",NA,7,15,2023-09-27,"19:58:00",NA,"n","william_hastie_pond",35.93335,-83.87679,2023,"autumn",270,270,276,273,275,276,275.5,273,"autumn","autumn",0,0,NA,NA,NA,NA,NA,NA,1,"negative",NA,NA,0,0
"MWUT114",26,NA,35.957846,-83.869324,NA,NA,"edge;mostly submerged",20,20,"racl",NA,"subadult",45,35.5,31,14,"y",NA,0,10,2022-05-30,"21:48:00","23:04:00","n","ijams_complex_pond3",35.957797,-83.869251,2022,"spring",150,83,269,176,NA,NA,NA,150,"summer","summer",0,0,NA,NA,NA,NA,NA,NA,1,"negative",NA,NA,0,0
"MWUT1140",147,NA,35.92497493,-83.87235241,NA,"9/27/2023 21:01","water;mostly submerged",18.7,20.1,"racl","female","adult",43.5,11,64.1,36.9,"y",NA,7,15,2023-09-27,"19:58:00",NA,"n","william_hastie_pond",35.93335,-83.87679,2023,"autumn",270,270,276,273,275,276,275.5,273,"autumn","autumn",0,0,NA,NA,NA,NA,NA,NA,1,"negative",NA,NA,0,0
"MWUT1141",147,NA,35.93330998,-83.87695534,NA,"9/27/2023 20:50","edge;mostly submerged",20,20,"racl",NA,"subadult",71,55,60.3,24.4,"y",NA,7,15,2023-09-27,"19:58:00",NA,"n","william_hastie_pond",35.93335,-83.87679,2023,"autumn",270,270,276,273,275,276,275.5,273,"autumn","autumn",0,0,NA,NA,NA,NA,NA,NA,1,"negative",NA,NA,0,0
"MWUT1142",147,NA,35.93329632,-83.87702797,NA,"9/27/2023 21:02","water;fully submerged",18.7,22.9,"racl",NA,"subadult",11,9.5,25.2,11.4,"y",NA,7,15,2023-09-27,"19:58:00",NA,"n","william_hastie_pond",35.93335,-83.87679,2023,"autumn",270,270,276,273,275,276,275.5,273,"autumn","autumn",0,0,NA,NA,NA,NA,NA,NA,1,"negative",NA,NA,0,0
"MWUT1143",148,NA,35.93337802,-83.87680164,NA,"10/2/2023 20:26","bank",19,20,"racl","female","adult",90,33,92.2,39.3,"y",NA,7,15,2023-10-02,"19:51:00","22:28:00","y","william_hastie_pond",35.93335,-83.87679,2023,"autumn",275,270,276,273,275,276,275.5,273,"autumn","autumn",0,0,NA,NA,NA,NA,NA,NA,1,"negative",NA,NA,0,0
"MWUT1144",148,NA,35.93336568,-83.87682324,NA,"10/2/2023 21:18","water;fully submerged",18,18,"novi","male","adult",45,41.5,47.9,NA,"y",NA,7,15,2023-10-02,"19:51:00","22:28:00","y","william_hastie_pond",35.93335,-83.87679,2023,"autumn",275,270,276,273,275,276,275.5,273,"autumn","autumn",0,0,NA,NA,NA,NA,NA,NA,1,"negative",NA,NA,0,0
"MWUT1145",148,NA,35.93330282,-83.87694653,NA,"10/2/2023 20:24","bank",18,19,"racl","male","adult",80,43,68.2,36.2,"y",NA,7,15,2023-10-02,"19:51:00","22:28:00","y","william_hastie_pond",35.93335,-83.87679,2023,"autumn",275,270,276,273,275,276,275.5,273,"autumn","autumn",0,0,NA,NA,NA,NA,NA,NA,1,"negative",NA,NA,0,0
"MWUT1146",148,NA,35.93337341,-83.87686125,NA,"10/2/2023 21:17","water;fully submerged",18,19,"novi","female","adult",60,57,44.4,NA,"y",NA,7,15,2023-10-02,"19:51:00","22:28:00","y","william_hastie_pond",35.93335,-83.87679,2023,"autumn",275,270,276,273,275,276,275.5,273,"autumn","autumn",0,0,NA,NA,NA,NA,NA,NA,1,"negative",NA,NA,0,0
"MWUT1147",148,NA,35.93331164,-83.87700029,NA,"10/2/2023 20:22","terrestrial",19,21,"racl",NA,"subadult",13,10,30.3,15,"y",NA,7,15,2023-10-02,"19:51:00","22:28:00","y","william_hastie_pond",35.93335,-83.87679,2023,"autumn",275,270,276,273,275,276,275.5,273,"autumn","autumn",0,0,NA,NA,NA,NA,NA,NA,1,"negative",NA,NA,0,0
"MWUT1148",148,NA,35.93330437,-83.87689189,NA,"10/2/2023","water;fully submerged",19.7,19.7,"novi","male","adult",80.5,78,44.4,NA,"y",NA,7,15,2023-10-02,"19:51:00","22:28:00","y","william_hastie_pond",35.93335,-83.87679,2023,"autumn",275,270,276,273,275,276,275.5,273,"autumn","autumn",0,0,NA,NA,NA,NA,NA,NA,1,"negative",NA,NA,0,0
"MWUT1149",148,NA,35.93333771,-83.8773561,NA,"10/2/2023","terrestrial",19,19,"racl",NA,"subadult",17,11,42.4,20,"y",NA,7,15,2023-10-02,"19:51:00","22:28:00","y","william_hastie_pond",35.93335,-83.87679,2023,"autumn",275,270,276,273,275,276,275.5,273,"autumn","autumn",0,0,NA,NA,NA,NA,NA,NA,1,"negative",NA,NA,0,0
"MWUT115",26,NA,35.957776,-83.86927,NA,NA,"water;submerged",20,20,"novi",NA,"adult",56,54.5,32,NA,"y",NA,0,10,2022-05-30,"21:48:00","23:04:00","n","ijams_complex_pond3",35.957797,-83.869251,2022,"spring",150,83,269,176,NA,NA,NA,150,"summer","summer",0,0,NA,NA,NA,NA,NA,NA,1,"negative",NA,NA,0,0
"MWUT1150",148,NA,35.93331854,-83.87698544,NA,"10/2/2023","water;fully submerged",19.5,19.5,"novi","male","adult",66,63,47.5,NA,"y",NA,7,15,2023-10-02,"19:51:00","22:28:00","y","william_hastie_pond",35.93335,-83.87679,2023,"autumn",275,270,276,273,275,276,275.5,273,"autumn","autumn",0,0,NA,NA,NA,NA,NA,NA,1,"negative",NA,NA,0,0
"MWUT1151",148,NA,35.93331719,-83.87694131,NA,"10/2/2023","water;fully submerged",19.9,19.9,"novi","male","adult",89,85,48.6,NA,"y",NA,7,15,2023-10-02,"19:51:00","22:28:00","y","william_hastie_pond",35.93335,-83.87679,2023,"autumn",275,270,276,273,275,276,275.5,273,"autumn","autumn",39.46,0,39.46,0.489946306,39.284,0,39.284,0.553860664,2,"positive",39.372,0.520932720466752,0.520932720466752,1
"MWUT1152",148,NA,35.9332488,-83.87690055,NA,"10/2/2023","water;fully submerged",19.7,19.7,"novi","male","adult",68.5,65.5,46.4,NA,"y",NA,7,15,2023-10-02,"19:51:00","22:28:00","y","william_hastie_pond",35.93335,-83.87679,2023,"autumn",275,270,276,273,275,276,275.5,273,"autumn","autumn",0,0,NA,NA,NA,NA,NA,NA,1,"negative",NA,NA,0,0
"MWUT1153",148,NA,35.93329801,-83.87690583,NA,"10/2/2023","water;fully submerged",19.7,19.7,"novi","male","adult",67,63.5,49.2,NA,"y",NA,7,15,2023-10-02,"19:51:00","22:28:00","y","william_hastie_pond",35.93335,-83.87679,2023,"autumn",275,270,276,273,275,276,275.5,273,"autumn","autumn",0,0,NA,NA,NA,NA,NA,NA,1,"negative",NA,NA,0,0
"MWUT1154",148,NA,35.93328205,-83.87693444,NA,"10/2/2023","water;fully submerged",19.7,19.7,"novi","male","adult",85,81,48.9,NA,"y",NA,7,15,2023-10-02,"19:51:00","22:28:00","y","william_hastie_pond",35.93335,-83.87679,2023,"autumn",275,270,276,273,275,276,275.5,273,"autumn","autumn",0,0,NA,NA,NA,NA,NA,NA,1,"negative",NA,NA,0,0
"MWUT1155",148,NA,35.93330799,-83.87689606,NA,"10/2/2023","water;fully submerged",19.7,19.7,"novi","male","adult",88.5,84.5,47.7,NA,"y",NA,7,15,2023-10-02,"19:51:00","22:28:00","y","william_hastie_pond",35.93335,-83.87679,2023,"autumn",275,270,276,273,275,276,275.5,273,"autumn","autumn",0,0,NA,NA,NA,NA,NA,NA,1,"negative",NA,NA,0,0
"MWUT1156",148,NA,35.93330491,-83.87690248,NA,"10/2/2023","water;fully submerged",19.7,19.7,"novi","male","adult",86,83,47.2,NA,"y",NA,7,15,2023-10-02,"19:51:00","22:28:00","y","william_hastie_pond",35.93335,-83.87679,2023,"autumn",275,270,276,273,275,276,275.5,273,"autumn","autumn",39.834,38.899,39.366,0.550718427,NA,NA,NA,NA,1,"positive",39.3665,0.522923805592876,0.522923805592876,1
"MWUT1158",151,NA,35.95066041,-83.69487918,NA,"10/11/2023 20:04","terrestrial",17,17,"raca",NA,"subadult",15,10,36.7,17.9,"y",NA,8,14,2023-10-11,"19:35:00","20:54:00","n","seven_islands_wetland",35.950339,-84.694773,2023,"autumn",284,284,284,284,NA,NA,NA,284,"autumn","autumn",0,0,NA,NA,NA,NA,NA,NA,1,"negative",NA,NA,0,0
"MWUT1159",153,NA,35.935667,-83.93987185,NA,"10/18/2023 19:43","edge;not submerged",11.3,11.7,"racl","female","adult",53.5,29,63.4,33.5,"y",NA,8,2,2023-10-18,"19:17:00","21:23:00","y","cherokee_woodlot_wetlands",35.935746,-83.939972,2023,"autumn",291,290,291,290.5,290,291,290.5,290.5,"autumn","autumn",0,0,NA,NA,NA,NA,NA,NA,1,"negative",NA,NA,0,0
"MWUT116",27,NA,35.956435,-83.868484,NA,NA,"water;slightly submerged",19,18,"novi",NA,"adult",37.5,32,48.5,NA,"y",NA,0,7,2022-05-30,"23:22:00","00:23:00","n","ijams_lotus_pond",35.956677,-83.868347,2022,"spring",150,83,207,145,NA,NA,NA,150,"summer","summer",0,0,NA,NA,NA,NA,NA,NA,1,"negative",NA,NA,0,0
"MWUT1160",153,NA,35.93562593,-83.93983883,NA,"10/18/2023 20:02","water;mostly submerged",10.4,10.9,"racl","female","adult",63,19.5,77,40.6,"y",NA,8,2,2023-10-18,"19:17:00","21:23:00","y","cherokee_woodlot_wetlands",35.935746,-83.939972,2023,"autumn",291,290,291,290.5,290,291,290.5,290.5,"autumn","autumn",0,0,NA,NA,NA,NA,NA,NA,1,"negative",NA,NA,0,0
"MWUT1161",153,NA,35.93560313,-83.93977848,NA,"10/18/2023 19:48","water;mostly submerged",10.6,10.8,"racl","male","adult",55,20,74.6,33.5,"y",NA,8,2,2023-10-18,"19:17:00","21:23:00","y","cherokee_woodlot_wetlands",35.935746,-83.939972,2023,"autumn",291,290,291,290.5,290,291,290.5,290.5,"autumn","autumn",27.614,27.128,27.371,2177.416992,NA,NA,NA,NA,1,"positive",27.371,2147.17448320619,2147.17448320619,1
"MWUT1162",153,NA,35.93576872,-83.94000571,NA,"10/18/2023 20:06","water;mostly submerged",11,11,"racl","female","adult",68,26,74.2,40.9,"y",NA,8,2,2023-10-18,"19:17:00","21:23:00","y","cherokee_woodlot_wetlands",35.935746,-83.939972,2023,"autumn",291,290,291,290.5,290,291,290.5,290.5,"autumn","autumn",0,0,NA,NA,NA,NA,NA,NA,1,"negative",NA,NA,0,0
"MWUT1163",153,NA,35.93563875,-83.93976917,NA,"10/18/2023 20:07","edge;not submerged",11,11,"racl","female","adult",70,29,74.1,37.8,"y",NA,8,2,2023-10-18,"19:17:00","21:23:00","y","cherokee_woodlot_wetlands",35.935746,-83.939972,2023,"autumn",291,290,291,290.5,290,291,290.5,290.5,"autumn","autumn",0,0,NA,NA,NA,NA,NA,NA,1,"negative",NA,NA,0,0
"MWUT1164",153,NA,35.93575878,-83.93998772,NA,"10/18/2023 19:57","edge;not submerged",10,11,"racl","female","adult",41,17,59,33,"y",NA,8,2,2023-10-18,"19:17:00","21:23:00","y","cherokee_woodlot_wetlands",35.935746,-83.939972,2023,"autumn",291,290,291,290.5,290,291,290.5,290.5,"autumn","autumn",39.758,0,39.758,0.398544312,0,0,NA,NA,2,"negative",39.758,0.398571342823112,0,0
"MWUT1165",153,NA,-83.93981947,35.93567743,NA,"10/18/2023 19:47","water;mostly submerged",16,17,"racl","male","adult",79,28,78.4,39.2,"y",NA,8,2,2023-10-18,"19:17:00","21:23:00","y","cherokee_woodlot_wetlands",35.935746,-83.939972,2023,"autumn",291,290,291,290.5,290,291,290.5,290.5,"autumn","autumn",31.923,31.818,31.87,94.81350708,NA,NA,NA,NA,1,"positive",31.8705,94.7269987601166,94.7269987601166,1
"MWUT1166",153,NA,35.93571885,-83.93998436,NA,"10/18/2023 19:50","bank",11,11,"racl","female","adult",63.5,25.5,72.3,37.9,"y",NA,8,2,2023-10-18,"19:17:00","21:23:00","y","cherokee_woodlot_wetlands",35.935746,-83.939972,2023,"autumn",291,290,291,290.5,290,291,290.5,290.5,"autumn","autumn",33.833,34.044,33.938,22.63086319,NA,NA,NA,NA,1,"positive",33.9385,22.5697069955719,22.5697069955719,1
"MWUT1167",153,NA,-83.93978066,35.93568762,NA,"10/18/2023 20:04","water;mostly submerged",15,17,"racl","male","adult",63,22,75.1,32.3,"y",NA,8,2,2023-10-18,"19:17:00","21:23:00","y","cherokee_woodlot_wetlands",35.935746,-83.939972,2023,"autumn",291,290,291,290.5,290,291,290.5,290.5,"autumn","autumn",0,0,NA,NA,NA,NA,NA,NA,1,"negative",NA,NA,0,0
"MWUT1168",153,NA,-83.9397758,35.93570317,NA,"10/18/2023 19:59","bank",16,15,"raca","female","adult",290,40,124.1,59.2,"y",NA,8,2,2023-10-18,"19:17:00","21:23:00","y","cherokee_woodlot_wetlands",35.935746,-83.939972,2023,"autumn",291,290,291,290.5,290,291,290.5,290.5,"autumn","autumn",0,0,NA,NA,NA,NA,NA,NA,1,"negative",NA,NA,0,0
"MWUT1169",153,NA,-83.93980999,35.9357874,NA,"10/18/2023 19:39","edge;not submerged",16,17,"racl","male","adult",56,22,72.1,37.3,"y",NA,8,2,2023-10-18,"19:17:00","21:23:00","y","cherokee_woodlot_wetlands",35.935746,-83.939972,2023,"autumn",291,290,291,290.5,290,291,290.5,290.5,"autumn","autumn",35.129,34.424,34.776,13.00115204,NA,NA,NA,NA,1,"positive",34.7765,12.6209914434507,12.6209914434507,1
"MWUT117",27,NA,35.956737,-83.868244,NA,NA,"water;submerged",19,19,"racl","female","adult",74.5,43,63.5,30.5,"y",NA,0,7,2022-05-30,"23:22:00","00:23:00","n","ijams_lotus_pond",35.956677,-83.868347,2022,"spring",150,83,207,145,NA,NA,NA,150,"summer","summer",0,0,NA,NA,NA,NA,NA,NA,1,"negative",NA,NA,0,0
"MWUT1170",153,NA,-83.93979155,35.93563301,NA,"10/18/2023 19:42","bank",16,16,"raca","female","adult",91,45,71,37.2,"y",NA,8,2,2023-10-18,"19:17:00","21:23:00","y","cherokee_woodlot_wetlands",35.935746,-83.939972,2023,"autumn",291,290,291,290.5,290,291,290.5,290.5,"autumn","autumn",30.581,30.778,30.679,216.929657,NA,NA,NA,NA,1,"positive",30.6795,216.391967791598,216.391967791598,1
"MWUT1171",153,NA,35.93573346,-83.93992929,NA,"10/18/2023 20:01","water;slightly submerged",10,11,"raca",NA,"subadult",59,39,56.3,29.3,"y",NA,8,2,2023-10-18,"19:17:00","21:23:00","y","cherokee_woodlot_wetlands",35.935746,-83.939972,2023,"autumn",291,290,291,290.5,290,291,290.5,290.5,"autumn","autumn",0,0,NA,NA,NA,NA,NA,NA,1,"negative",NA,NA,0,0
"MWUT1172",153,NA,35.93573041,-83.93997631,NA,"10/18/2023 19:47","edge;mostly submerged",11,11,"raca",NA,"subadult",41,20,63.9,29.9,"y",NA,8,2,2023-10-18,"19:17:00","21:23:00","y","cherokee_woodlot_wetlands",35.935746,-83.939972,2023,"autumn",291,290,291,290.5,290,291,290.5,290.5,"autumn","autumn",0,0,NA,NA,NA,NA,NA,NA,1,"negative",NA,NA,0,0
"MWUT1173",153,NA,35.93567247,-83.94003982,NA,"10/18/2023 19:48","edge;not submerged",10,10,"raca",NA,"subadult",39.5,24,61.2,38.9,"y",NA,8,2,2023-10-18,"19:17:00","21:23:00","y","cherokee_woodlot_wetlands",35.935746,-83.939972,2023,"autumn",291,290,291,290.5,290,291,290.5,290.5,"autumn","autumn",24.937,25.073,25.005,11095.05664,NA,NA,NA,NA,1,"positive",25.005,11081.0864169377,11081.0864169377,1
"MWUT1174",153,NA,35.9355689,-83.9399518,NA,"10/18/2023 21:01","water;mostly submerged",11,10,"racl","male","adult",57.5,19.5,67.9,35.8,"y",NA,8,2,2023-10-18,"19:17:00","21:23:00","y","cherokee_woodlot_wetlands",35.935746,-83.939972,2023,"autumn",291,290,291,290.5,290,291,290.5,290.5,"autumn","autumn",35.781,35.806,35.794,6.233672142,NA,NA,NA,NA,1,"positive",35.7935,6.23362235883743,6.23362235883743,1
"MWUT1175",155,NA,-83.87658592,35.93327261,NA,"10/25/2023 19:17","terrestrial",15,15,"racl",NA,"subadult",18,12.5,37.1,20.1,"y",NA,8,15,2023-10-25,"19:07:00","22:05:00","n","william_hastie_pond",35.93335,-83.87679,2023,"autumn",298,297,319,308,NA,NA,NA,308,"autumn","autumn",0,0,NA,NA,NA,NA,NA,NA,1,"negative",NA,NA,0,0
"MWUT1176",155,NA,35.93330569,-83.87707673,NA,"10/25/2023 19:47","terrestrial",15,17,"racl",NA,"subadult",12,9.5,31.8,15.8,"y",NA,8,15,2023-10-25,"19:07:00","22:05:00","n","william_hastie_pond",35.93335,-83.87679,2023,"autumn",298,297,319,308,NA,NA,NA,308,"autumn","autumn",0,0,NA,NA,NA,NA,NA,NA,1,"negative",NA,NA,0,0
"MWUT1177",155,NA,-83.87682029,35.93336463,NA,"10/25/2023 20:21","water;fully submerged",13,13,"novi","female","adult",82,79,44.1,NA,"y",NA,8,15,2023-10-25,"19:07:00","22:05:00","n","william_hastie_pond",35.93335,-83.87679,2023,"autumn",298,297,319,308,NA,NA,NA,308,"autumn","autumn",33.381,32.761,33.071,42.15745163,NA,NA,NA,NA,1,"positive",33.071,41.1950197004539,41.1950197004539,1
"MWUT1178",155,NA,35.93336248,-83.8768966,NA,"10/25/2023 20:21","water;mostly submerged",15,15,"racl","female","adult",48.5,32,50.3,28.9,"y",NA,8,15,2023-10-25,"19:07:00","22:05:00","n","william_hastie_pond",35.93335,-83.87679,2023,"autumn",298,297,319,308,NA,NA,NA,308,"autumn","autumn",32.149,31.59,31.87,96.57324219,NA,NA,NA,NA,1,"positive",31.8695,94.7927253730818,94.7927253730818,1
"MWUT1179",155,NA,35.93333981,-83.87694103,NA,"10/25/2023 20:22","water;mostly submerged",13,14,"racl",NA,"subadult",60,49,44.6,23.9,"y",NA,8,15,2023-10-25,"19:07:00","22:05:00","n","william_hastie_pond",35.93335,-83.87679,2023,"autumn",298,297,319,308,NA,NA,NA,308,"autumn","autumn",37.89,34.833,36.361,6.797176838,NA,NA,NA,NA,1,"positive",36.3615,4.20378688000562,4.20378688000562,1
"MWUT118",27,NA,35.956773,-83.868237,NA,NA,"water;submerged",20,20,"novi",NA,"adult",53,48,36,NA,"y",NA,0,7,2022-05-30,"23:22:00","00:23:00","n","ijams_lotus_pond",35.956677,-83.868347,2022,"spring",150,83,207,145,NA,NA,NA,150,"summer","summer",0,0,NA,NA,NA,NA,NA,NA,1,"negative",NA,NA,0,0
